;Lambda Labs;US$1,50 ;10/5/23;United States;San Francisco;Enterprise Tech;1517 Fund, Gradient Ventures, Bloomberg Beta;;;;;;;;;;;;;;;;;;;;;;;;;;;;;;;;;;;;;;;;;;;;;;;;;;;;;;
;Cognite;US$1,50 ;5/19/21;Norway;Lysaker;Industrials;Technology Crossover Ventures, Accel, Aker;;;;;;;;;;;;;;;;;;;;;;;;;;;;;;;;;;;;;;;;;;;;;;;;;;;;;;
;Altruist;US$1,50 ;4/16/24;United States;Culver City;Financial Services;Venrock, Endeavor, Adams Street Partners;;;;;;;;;;;;;;;;;;;;;;;;;;;;;;;;;;;;;;;;;;;;;;;;;;;;;;
;ASAPP;US$1,60 ;5/19/21;United States;New York;Enterprise Tech;March Capital Partners, HOF Capital, Emergence Capital Partners;;;;;;;;;;;;;;;;;;;;;;;;;;;;;;;;;;;;;;;;;;;;;;;;;;;;;;
;SmartHR;US$1,60 ;6/8/21;Japan;Tokyo;Enterprise Tech;BEENEXT, World Innovation Lab, Light Street Capital;;;;;;;;;;;;;;;;;;;;;;;;;;;;;;;;;;;;;;;;;;;;;;;;;;;;;;
;Mercury;US$1,60 ;7/3/21;United States;San Francisco;Financial Services;Andreessen Horowitz, Coatue Management, Clocktower Technology Ventures;;;;;;;;;;;;;;;;;;;;;;;;;;;;;;;;;;;;;;;;;;;;;;;;;;;;;;
;HomeLight;US$1,70 ;9/2/21;United States;San Francisco;Financial Services;Zeev Ventures, Menlo Ventures,Crosslink Capital;;;;;;;;;;;;;;;;;;;;;;;;;;;;;;;;;;;;;;;;;;;;;;;;;;;;;;
;ezCater;US$1,60 ;4/2/19;United States;Boston;Consumer & Retail;Insight Venture Partners, ICONIQ Capital, Launchpad Venture Group;;;;;;;;;;;;;;;;;;;;;;;;;;;;;;;;;;;;;;;;;;;;;;;;;;;;;;
;Wayflyer;US$1,60 ;2/1/22;Ireland;Dublin;Financial Services;QED Investors, DST Global, Left Lane Capital;;;;;;;;;;;;;;;;;;;;;;;;;;;;;;;;;;;;;;;;;;;;;;;;;;;;;;
;Capitolis;US$1,60 ;3/22/22;United States;New York;Financial Services;Sequoia Capital, Index Ventures, S Capital;;;;;;;;;;;;;;;;;;;;;;;;;;;;;;;;;;;;;;;;;;;;;;;;;;;;;;
;Magic Eden;US$1,60 ;6/21/22;United States;San Francisco;Media & Entertainment;Sequoia Capital, Lightspeed Venture Partners, Paradigm;;;;;;;;;;;;;;;;;;;;;;;;;;;;;;;;;;;;;;;;;;;;;;;;;;;;;;
;Pave;US$1,60 ;6/28/22;United States;San Francisco;Enterprise Tech;Y Combinator, Andreessen Horowitz, Bessemer Venture Partners;;;;;;;;;;;;;;;;;;;;;;;;;;;;;;;;;;;;;;;;;;;;;;;;;;;;;;
;Astranis;US$1,60 ;4/14/21;United States;San Francisco;Industrials;Refactor Capital, Andreessen Horowitz, Fifty Years Fund;;;;;;;;;;;;;;;;;;;;;;;;;;;;;;;;;;;;;;;;;;;;;;;;;;;;;;
;Promasidor Holdings;US$1,59 ;11/8/16;South Africa;Bryanston;Consumer & Retail;IFC, Ajinomoto;;;;;;;;;;;;;;;;;;;;;;;;;;;;;;;;;;;;;;;;;;;;;;;;;;;;;;
;GalaxySpace;US$1,58 ;11/17/20;China;Beijing;Industrials;Shunwei Capital Partners, 5Y Capital, Legend Capital;;;;;;;;;;;;;;;;;;;;;;;;;;;;;;;;;;;;;;;;;;;;;;;;;;;;;;
;Icon;US$1,57 ;2/18/22;United States;Austin;Industrials;Moderne Ventures, Oakhouse Partners, Bjarke Ingels Group;;;;;;;;;;;;;;;;;;;;;;;;;;;;;;;;;;;;;;;;;;;;;;;;;;;;;;
;Fresh Life Style Supply Chain Management;US$1,57 ;3/11/22;China;Chengdu;Consumer & Retail;Guiyang Venture Capital, Longfor Capital, CAOGENZHIBEN GROUP;;;;;;;;;;;;;;;;;;;;;;;;;;;;;;;;;;;;;;;;;;;;;;;;;;;;;;
;Alloy;US$1,55 ;9/30/21;United States;New York;Financial Services;Bessemer Venture Partners, Eniac Ventures, Canapi Ventures;;;;;;;;;;;;;;;;;;;;;;;;;;;;;;;;;;;;;;;;;;;;;;;;;;;;;;
;Huntress;US$1,55 ;6/18/24;United States;Ellicott City;Enterprise Tech;ForgePoint Capital, Sapphire Ventures, Gula Tech Adventures;;;;;;;;;;;;;;;;;;;;;;;;;;;;;;;;;;;;;;;;;;;;;;;;;;;;;;
;Baiwang;US$1,55 ;3/25/19;China;Beijing;Enterprise Tech;Guozhong Venture Capital Management, Shenzhen Capital Group, Oriental Fortune Capital;;;;;;;;;;;;;;;;;;;;;;;;;;;;;;;;;;;;;;;;;;;;;;;;;;;;;;
;Iluvatar CoreX;US$1,55 ;3/1/21;China;Shanghai;Enterprise Tech;Centurium Capital, Cedarlake Capital, Unicom Innovation Venture Capital;;;;;;;;;;;;;;;;;;;;;;;;;;;;;;;;;;;;;;;;;;;;;;;;;;;;;;
;Wenheyou;US$1,55 ;4/17/21;China;Hunan;Consumer & Retail;Sequoia Capital China, Warburg Pincus, IDG Capital;;;;;;;;;;;;;;;;;;;;;;;;;;;;;;;;;;;;;;;;;;;;;;;;;;;;;;
;Kitopi;US$1,55 ;7/1/21;United Arab Emirates;Dubai;Consumer & Retail;CE-Ventures, BECO Capital, Nordstar;;;;;;;;;;;;;;;;;;;;;;;;;;;;;;;;;;;;;;;;;;;;;;;;;;;;;;
;Ximalaya FM;US$1,52 ;9/22/17;China;Shanghai;Media & Entertainment;China Creation Ventures, Sierra Ventures, Xingwang Investment Management;;;;;;;;;;;;;;;;;;;;;;;;;;;;;;;;;;;;;;;;;;;;;;;;;;;;;;
;Carzone;US$1,52 ;3/1/19;China;Jiangsu;Industrials;Alibaba Group,Co-Stone Venture Capital, Buhuo Venture Capital;;;;;;;;;;;;;;;;;;;;;;;;;;;;;;;;;;;;;;;;;;;;;;;;;;;;;;
;Tabby;US$1,50 ;11/1/23;United Arab Emirates;Dubai;Financial Services;Arbor Ventures, STV, Global Founders Capital;;;;;;;;;;;;;;;;;;;;;;;;;;;;;;;;;;;;;;;;;;;;;;;;;;;;;;
;Runway;US$1,50 ;5/4/23;United States;New York;Media & Entertainment;Lux Capital, Compound, Amplify Partners;;;;;;;;;;;;;;;;;;;;;;;;;;;;;;;;;;;;;;;;;;;;;;;;;;;;;;
;Skild AI;US$1,50 ;7/9/24;United States;Pittsburgh;Industrials;CRV, General Catalyst, Menlo Ventures;;;;;;;;;;;;;;;;;;;;;;;;;;;;;;;;;;;;;;;;;;;;;;;;;;;;;;
;Sigma Computing;US$1,50 ;5/16/24;United States;San Francisco;Enterprise Tech;Sutter Hill Ventures, Snowflake Ventures, NewView Capital;;;;;;;;;;;;;;;;;;;;;;;;;;;;;;;;;;;;;;;;;;;;;;;;;;;;;;
;Harvey;US$1,50 ;7/23/24;United States;San Francisco;Enterprise Tech;OpenAI Startup Fund, Kleiner Perkins, Sequoia Capital;;;;;;;;;;;;;;;;;;;;;;;;;;;;;;;;;;;;;;;;;;;;;;;;;;;;;;
;OpenWeb;US$1,50 ;11/9/21;United States;New York;Media & Entertainment;Insight Partners, AltaIR Capital, Norma Investments;;;;;;;;;;;;;;;;;;;;;;;;;;;;;;;;;;;;;;;;;;;;;;;;;;;;;;
;First Mode;US$1,50 ;12/7/22;United States;Seattle;Industrials;Anglo American;;;;;;;;;;;;;;;;;;;;;;;;;;;;;;;;;;;;;;;;;;;;;;;;;;;;;;
;Mu Sigma;US$1,50 ;2/7/13;United States;Northbrook;Enterprise Tech;Sequoia Capital, General Atlantic;;;;;;;;;;;;;;;;;;;;;;;;;;;;;;;;;;;;;;;;;;;;;;;;;;;;;;
;Kushki;US$1,50 ;6/7/22;Ecuador;Quito;Financial Services;Clocktower Technology Ventures, DILA Capital, Kaszek Ventures;;;;;;;;;;;;;;;;;;;;;;;;;;;;;;;;;;;;;;;;;;;;;;;;;;;;;;
;Jasper;US$1,50 ;10/17/22;United States;Austin;Enterprise Tech;Foundation Capital, Institutional Venture Partners, Founders Capital;;;;;;;;;;;;;;;;;;;;;;;;;;;;;;;;;;;;;;;;;;;;;;;;;;;;;;
;Orna Therapeutics;US$1,50 ;8/16/22;United States;Cambridge;Healthcare & Life Sciences;MPM Capital, Astellas Venture Management, F2 Ventures;;;;;;;;;;;;;;;;;;;;;;;;;;;;;;;;;;;;;;;;;;;;;;;;;;;;;;
;TuJia;US$1,50 ;6/17/15;China;Beijing;Consumer & Retail;GGV Capital, QiMing Venture Partnersl;;;;;;;;;;;;;;;;;;;;;;;;;;;;;;;;;;;;;;;;;;;;;;;;;;;;;;
;Mofang Living;US$1,50 ;4/13/16;China;Shanghai;Consumer & Retail;Warburg Pincus, Aviation Industry Corporation of China;;;;;;;;;;;;;;;;;;;;;;;;;;;;;;;;;;;;;;;;;;;;;;;;;;;;;;
;DT Dream;US$1,50 ;6/8/17;China;Hangzhou;Enterprise Tech;Alibaba Group, China Everbright Investment Management, Yinxinggu Capital;;;;;;;;;;;;;;;;;;;;;;;;;;;;;;;;;;;;;;;;;;;;;;;;;;;;;;
;Changingedu;US$1,50 ;10/30/17;China;Shanghai;Consumer & Retail;Trustbridge Partners, IDG Capital, Sequoia Capital China;;;;;;;;;;;;;;;;;;;;;;;;;;;;;;;;;;;;;;;;;;;;;;;;;;;;;;
;XiaoZhu;US$1,50 ;11/1/17;China;Beijing;Consumer & Retail;Morningside Ventures, Capital Today, JOY Capital;;;;;;;;;;;;;;;;;;;;;;;;;;;;;;;;;;;;;;;;;;;;;;;;;;;;;;
;JOLLY Information Technology;US$1,50 ;5/29/18;China;Hangzhou;Consumer & Retail;Legend Capital, CDH Investments, Sequoia Capital China;;;;;;;;;;;;;;;;;;;;;;;;;;;;;;;;;;;;;;;;;;;;;;;;;;;;;;
;Yijiupi;US$1,50 ;9/20/18;China;Beijing;Consumer & Retail;Source Code Capital, Meituan Dianping, Tencent Holdings;;;;;;;;;;;;;;;;;;;;;;;;;;;;;;;;;;;;;;;;;;;;;;;;;;;;;;
;Cambridge Mobile Telematics;US$1,50 ;12/19/18;United States;Cambridge;Insurance;SoftBank Group;;;;;;;;;;;;;;;;;;;;;;;;;;;;;;;;;;;;;;;;;;;;;;;;;;;;;;
;Collective Health;US$1,50 ;6/17/19;United States;San Francisco;Healthcare & Life Sciences;New Enterprise Associates, Founders Fund, Google Ventures;;;;;;;;;;;;;;;;;;;;;;;;;;;;;;;;;;;;;;;;;;;;;;;;;;;;;;
;Strava;US$1,50 ;11/16/20;United States;San Francisco;Healthcare & Life Sciences;Jackson Square Ventures, Madrone Capital Partners, Sequoia Capital;;;;;;;;;;;;;;;;;;;;;;;;;;;;;;;;;;;;;;;;;;;;;;;;;;;;;;
;Zenoti;US$1,50 ;12/15/20;United States;Bellevue;Consumer & Retail;Norwest Venture Partners, Accel, Tiger Global Management;;;;;;;;;;;;;;;;;;;;;;;;;;;;;;;;;;;;;;;;;;;;;;;;;;;;;;
;K Health;US$1,50 ;1/19/21;United States;New York;Healthcare & Life Sciences;Max Ventures, Mangrove Capital Partners, 14W;;;;;;;;;;;;;;;;;;;;;;;;;;;;;;;;;;;;;;;;;;;;;;;;;;;;;;
;Uplight;US$1,50 ;3/3/21;United States;Boulder;Industrials;Rubicon Technology Partners, Max Ventures, Inclusive Capital Partners;;;;;;;;;;;;;;;;;;;;;;;;;;;;;;;;;;;;;;;;;;;;;;;;;;;;;;
;Snapdocs;US$1,50 ;5/25/21;United States;San Francisco;Financial Services;Sequoia Capital, Y Combinator, F-Prime Capital;;;;;;;;;;;;;;;;;;;;;;;;;;;;;;;;;;;;;;;;;;;;;;;;;;;;;;
;Chipper Cash;US$2,00 ;5/31/21;United States;San Francisco;Financial Services;Deciens Capital, Bezos Expeditions, 500 Startups;;;;;;;;;;;;;;;;;;;;;;;;;;;;;;;;;;;;;;;;;;;;;;;;;;;;;;
;Ledger;US$1,47 ;6/10/21;France;Paris;Financial Services;Digital Currency Group, Draper Esprit, Korelya Capital;;;;;;;;;;;;;;;;;;;;;;;;;;;;;;;;;;;;;;;;;;;;;;;;;;;;;;
;Next Silicon;US$1,50 ;6/14/21;Israel;Tel Aviv;Enterprise Tech;Amiti Ventures, Playground Global, Aleph;;;;;;;;;;;;;;;;;;;;;;;;;;;;;;;;;;;;;;;;;;;;;;;;;;;;;;
;YQNlink;US$1,50 ;6/29/21;China;Shanghai;Industrials;Source Code Capital, Coatue Management, DCM Ventures;;;;;;;;;;;;;;;;;;;;;;;;;;;;;;;;;;;;;;;;;;;;;;;;;;;;;;
;impact.com;US$1,50 ;7/13/21;United States;Santa Barbara;Enterprise Tech;Redpoint Ventures, Providence Equity Partners, Silversmith Capital Partners;;;;;;;;;;;;;;;;;;;;;;;;;;;;;;;;;;;;;;;;;;;;;;;;;;;;;;
;SmartRecruiters;US$1,50 ;7/20/21;United States;San Francisco;Enterprise Tech;Mayfield Fund, Insight Partners, Rembrandt Venture Partners;;;;;;;;;;;;;;;;;;;;;;;;;;;;;;;;;;;;;;;;;;;;;;;;;;;;;;
;NotCo;US$1,50 ;7/26/21;Chile;Santiago;Consumer & Retail;Kaszek Ventures, SOSV, Tiger Global Management;;;;;;;;;;;;;;;;;;;;;;;;;;;;;;;;;;;;;;;;;;;;;;;;;;;;;;
;Culture Amp;US$1,50 ;7/29/21;Australia;Richmond;Enterprise Tech;Felicis Ventures, Index Ventures, Blackbird Ventures;;;;;;;;;;;;;;;;;;;;;;;;;;;;;;;;;;;;;;;;;;;;;;;;;;;;;;
;TaxBit;US$1,50 ;8/4/21;United States;Draper;Financial Services;Insight Partners, Coinbase Ventures, PayPal Ventures;;;;;;;;;;;;;;;;;;;;;;;;;;;;;;;;;;;;;;;;;;;;;;;;;;;;;;
;Pacaso;US$1,50 ;3/24/21;United States;Cincinnati;Financial Services;Global Founders Capital, Shea Ventures, Greycroft;;;;;;;;;;;;;;;;;;;;;;;;;;;;;;;;;;;;;;;;;;;;;;;;;;;;;;
;1047 Games;US$1,50 ;9/14/21;United States;Zephyr Cove;Media & Entertainment;VGames, Lakestar, Galaxy Interactive;;;;;;;;;;;;;;;;;;;;;;;;;;;;;;;;;;;;;;;;;;;;;;;;;;;;;;
;Matillion;US$1,50 ;9/15/21;United Kingdom;Altrincham;Enterprise Tech;Scale Venture Partners, Sapphire Ventures, Battery Ventures;;;;;;;;;;;;;;;;;;;;;;;;;;;;;;;;;;;;;;;;;;;;;;;;;;;;;;
;Persona;US$1,50 ;9/15/21;United States;San Francisco;Enterprise Tech;Coatue Management, Index Ventures, Founders Fund;;;;;;;;;;;;;;;;;;;;;;;;;;;;;;;;;;;;;;;;;;;;;;;;;;;;;;
;Ascend Money;US$1,50 ;9/27/21;Thailand;Bangkok;Financial Services;Ant Group, Charoen Pokphand Group, Bow Wave Capital;;;;;;;;;;;;;;;;;;;;;;;;;;;;;;;;;;;;;;;;;;;;;;;;;;;;;;
;Andela;US$1,50 ;9/29/21;United States;New York;Enterprise Tech;Spark Capital, Google Ventures, CRE Venture Capital;;;;;;;;;;;;;;;;;;;;;;;;;;;;;;;;;;;;;;;;;;;;;;;;;;;;;;
;Built;US$1,50 ;9/30/21;United States;Nashville;Financial Services;Nyca Partners, Index Ventures, Technology Crossover Ventures;;;;;;;;;;;;;;;;;;;;;;;;;;;;;;;;;;;;;;;;;;;;;;;;;;;;;;
;CoinList;US$1,50 ;10/15/21;United States;San Francisco;Financial Services;Accomplice, Polychain Capital, GoldenTree Asset Management;;;;;;;;;;;;;;;;;;;;;;;;;;;;;;;;;;;;;;;;;;;;;;;;;;;;;;
;Lusha;US$1,50 ;11/10/21;United States;New York;Enterprise Tech;PSG, ION Crossover Partners;;;;;;;;;;;;;;;;;;;;;;;;;;;;;;;;;;;;;;;;;;;;;;;;;;;;;;
;cult.fit;US$1,50 ;11/10/21;India;Bengaluru;Healthcare & Life Sciences;Chiratae Ventures, Accel, Kalaari Capital;;;;;;;;;;;;;;;;;;;;;;;;;;;;;;;;;;;;;;;;;;;;;;;;;;;;;;
;Olist;US$1,50 ;12/15/21;Brazil;Curitiba;Consumer & Retail;Redpoint e.ventures, Valor Capital Group, SoftBank Latin America Fund;;;;;;;;;;;;;;;;;;;;;;;;;;;;;;;;;;;;;;;;;;;;;;;;;;;;;;
;Paradox;US$1,50 ;12/27/21;United States;Scottsdale;Enterprise Tech;Brighton Park Capital, Blue Cloud Ventures, Workday Ventures;;;;;;;;;;;;;;;;;;;;;;;;;;;;;;;;;;;;;;;;;;;;;;;;;;;;;;
;Airbyte;US$1,50 ;12/17/21;United States;San Francisco;Enterprise Tech;Accel, Benchmark, SV Angel;;;;;;;;;;;;;;;;;;;;;;;;;;;;;;;;;;;;;;;;;;;;;;;;;;;;;;
;StoreDot;US$1,50 ;1/4/22;Israel;Herzliya;Industrials;Samsung Ventures, SingulariTeam, BP Ventures;;;;;;;;;;;;;;;;;;;;;;;;;;;;;;;;;;;;;;;;;;;;;;;;;;;;;;
;Spendesk;US$1,50 ;1/18/22;France;Paris;Enterprise Tech;Index Ventures, Eight Roads Ventures, General Atlantic;;;;;;;;;;;;;;;;;;;;;;;;;;;;;;;;;;;;;;;;;;;;;;;;;;;;;;
;Veriff;US$1,50 ;1/26/22;Estonia;Tallinn;Enterprise Tech;Accel, Institutional Venture Partners, Tiger Global Management;;;;;;;;;;;;;;;;;;;;;;;;;;;;;;;;;;;;;;;;;;;;;;;;;;;;;;
;ElasticRun;US$1,50 ;2/7/22;India;Pune;Industrials;Kalaari Capital, Norwest Venture Partners, Prosus Ventures;;;;;;;;;;;;;;;;;;;;;;;;;;;;;;;;;;;;;;;;;;;;;;;;;;;;;;
;Veho;US$1,50 ;12/21/21;United States;Boulder;Consumer & Retail;General Catalyst, Origin Ventures, Fontinalis Partners;;;;;;;;;;;;;;;;;;;;;;;;;;;;;;;;;;;;;;;;;;;;;;;;;;;;;;
;Temporal;US$1,50 ;2/16/22;United States;Bellevue;Enterprise Tech;Amplify Partners, Addition, Madrona Venture Group;;;;;;;;;;;;;;;;;;;;;;;;;;;;;;;;;;;;;;;;;;;;;;;;;;;;;;
;Fabric;US$1,50 ;2/24/22;United States;Bellevue;Consumer & Retail;Redpoint Ventures, Norwest Venture Partners, Sierra Ventures;;;;;;;;;;;;;;;;;;;;;;;;;;;;;;;;;;;;;;;;;;;;;;;;;;;;;;
;Zeta;US$1,50 ;5/24/21;United States;San Francisco;Financial Services;Sodexo Ventures, SoftBank Group;;;;;;;;;;;;;;;;;;;;;;;;;;;;;;;;;;;;;;;;;;;;;;;;;;;;;;
;Boba;US$1,50 ;4/5/22;United States;San Francisco;Enterprise Tech;DeFi Technologies, Hypersphere Ventures, M13;;;;;;;;;;;;;;;;;;;;;;;;;;;;;;;;;;;;;;;;;;;;;;;;;;;;;;
;Upside;US$1,50 ;4/26/22;United States;DC;Consumer & Retail;Bessemer Venture Partners, Builders VC, General Catalyst;;;;;;;;;;;;;;;;;;;;;;;;;;;;;;;;;;;;;;;;;;;;;;;;;;;;;;
;Mashgin;US$1,50 ;5/9/22;United States;Palo Alto;Consumer & Retail;New Enterprise Associates, Matrix Partmers, Susa Ventures;;;;;;;;;;;;;;;;;;;;;;;;;;;;;;;;;;;;;;;;;;;;;;;;;;;;;;
;Dock;US$1,50 ;5/12/22;Brazil;Sao Paulo;Financial Services;Viking Global Investors, Riverwood Capital, Lightrock;;;;;;;;;;;;;;;;;;;;;;;;;;;;;;;;;;;;;;;;;;;;;;;;;;;;;;
;Prometheus;US$1,50 ;9/23/21;United States;Santa Cruz;Industrials;BMW i Ventures, Metaplanet, Maersk Growth;;;;;;;;;;;;;;;;;;;;;;;;;;;;;;;;;;;;;;;;;;;;;;;;;;;;;;
;5ire;US$1,50 ;7/15/22;United Kingdom;London;Enterprise Tech;Global Emerging Markets, Sram & Mram Group, Marshland Capital;;;;;;;;;;;;;;;;;;;;;;;;;;;;;;;;;;;;;;;;;;;;;;;;;;;;;;
;Yipin Shengxian;US$1,49 ;3/11/19;China;Hefei;Consumer & Retail;Eastern Bell Capital, Capital Today, Longzhu Capital;;;;;;;;;;;;;;;;;;;;;;;;;;;;;;;;;;;;;;;;;;;;;;;;;;;;;;
;Agibank;US$1,49 ;12/24/24;Brazil;Campinas;Financial Services;;;;;;;;;;;;;;;;;;;;;;;;;;;;;;;;;;;;;;;;;;;;;;;;;;;;;;;
;Bordrin Motors;US$1,48 ;6/3/19;China;Shanghai;Industrials;China Grand Prosperity Investment, CSC Group;;;;;;;;;;;;;;;;;;;;;;;;;;;;;;;;;;;;;;;;;;;;;;;;;;;;;;
;Arcadia;US$1,48 ;5/10/22;United States;DC;Enterprise Tech;BoxGroup, Energy Impact Partners, Camber Creek;;;;;;;;;;;;;;;;;;;;;;;;;;;;;;;;;;;;;;;;;;;;;;;;;;;;;;
;VTS;US$1,47 ;5/7/19;United States;New York;Financial Services;Trinity Ventures, Fifth Wall Ventures, OpenView Venture Partners;;;;;;;;;;;;;;;;;;;;;;;;;;;;;;;;;;;;;;;;;;;;;;;;;;;;;;
;Shukun Technology;US$1,46 ;8/16/21;China;Beijing;Healthcare & Life Sciences;Marathon Venture Partners, Huagai Capital, China Creation Ventures;;;;;;;;;;;;;;;;;;;;;;;;;;;;;;;;;;;;;;;;;;;;;;;;;;;;;;
;Huasun;US$1,46 ;1/19/23;China;Xuancheng;Industrials;Hongtai Capital Holdings, Jintou Zhiyuan;;;;;;;;;;;;;;;;;;;;;;;;;;;;;;;;;;;;;;;;;;;;;;;;;;;;;;
;Loft;US$1,46 ;1/3/20;Brazil;Sao Paulo;Financial Services;Monashees+, Andreessen Horowitz, QED Investors;;;;;;;;;;;;;;;;;;;;;;;;;;;;;;;;;;;;;;;;;;;;;;;;;;;;;;
;Coocaa;US$1,45 ;3/16/18;China;Shenzhen;Media & Entertainment;Baidu, Tencent Holdings;;;;;;;;;;;;;;;;;;;;;;;;;;;;;;;;;;;;;;;;;;;;;;;;;;;;;;
;Placer.ai;US$1,45 ;1/12/22;United States;Los Altos;Consumer & Retail;Fifth Wall Ventures, JBV Capital, Array Ventures;;;;;;;;;;;;;;;;;;;;;;;;;;;;;;;;;;;;;;;;;;;;;;;;;;;;;;
;Juma Peisong;US$1,45 ;11/26/18;China;Chengdu;Industrials;Ding Xiang Capital, New Hope Fund, Sino-Ocean Capital;;;;;;;;;;;;;;;;;;;;;;;;;;;;;;;;;;;;;;;;;;;;;;;;;;;;;;
;Ouyeel;US$1,45 ;6/27/19;China;Shanghai;Industrials;Taigang Venture Capital;;;;;;;;;;;;;;;;;;;;;;;;;;;;;;;;;;;;;;;;;;;;;;;;;;;;;;
;Gymshark;US$1,45 ;8/14/20;United Kingdom;Solihull;Consumer & Retail;General Atlantic;;;;;;;;;;;;;;;;;;;;;;;;;;;;;;;;;;;;;;;;;;;;;;;;;;;;;;
;M1;US$1,45 ;7/14/21;United States;Chicago;Financial Services;Left Lane Capital, Clocktower Technology Ventures, Jump Capital;;;;;;;;;;;;;;;;;;;;;;;;;;;;;;;;;;;;;;;;;;;;;;;;;;;;;;
;Aleo;US$1,45 ;2/7/22;United States;San Francisco;Enterprise Tech;Slow Ventures, Andreessen Horowitz, SoftBank Group;;;;;;;;;;;;;;;;;;;;;;;;;;;;;;;;;;;;;;;;;;;;;;;;;;;;;;
;Einride;US$1,44 ;12/31/21;Sweden;Stockholm;Industrials;Temasek, BUILD Capital Partners, Northzone Ventures;;;;;;;;;;;;;;;;;;;;;;;;;;;;;;;;;;;;;;;;;;;;;;;;;;;;;;
;Justworks;US$1,43 ;1/28/20;United States;New York;Enterprise Tech;Index Ventures, Thrive Capital, Bain Capital Ventures;;;;;;;;;;;;;;;;;;;;;;;;;;;;;;;;;;;;;;;;;;;;;;;;;;;;;;
;Valgen Medtech;US$1,43 ;5/6/21;China;Hangzhou;Healthcare & Life Sciences;Sequoia Capital China, China Life Investment Holding Company, Qiming Venture Partners;;;;;;;;;;;;;;;;;;;;;;;;;;;;;;;;;;;;;;;;;;;;;;;;;;;;;;
;SonderMind;US$1,42 ;7/28/21;United States;Denver;Healthcare & Life Sciences;Kickstart Fund, General Catalyst, Drive Capital;;;;;;;;;;;;;;;;;;;;;;;;;;;;;;;;;;;;;;;;;;;;;;;;;;;;;;
;EON;US$1,40 ;11/26/24;United States;New York;Enterprise Tech;Lightspeed Venture Partners, Sequoia Capital, Bond;;;;;;;;;;;;;;;;;;;;;;;;;;;;;;;;;;;;;;;;;;;;;;;;;;;;;;
;Route;US$1,40 ;1/21/22;United States;Lehi;Enterprise Tech;Album VC, Madrona Venture Group, Craft Ventures;;;;;;;;;;;;;;;;;;;;;;;;;;;;;;;;;;;;;;;;;;;;;;;;;;;;;;
;NIUM;US$1,40 ;7/13/21;Singapore;;Financial Services;Vertex Ventures SE Asia, Global Founders Capital, Visa Ventures;;;;;;;;;;;;;;;;;;;;;;;;;;;;;;;;;;;;;;;;;;;;;;;;;;;;;;
;Fox Ess;US$1,40 ;5/26/23;China;Wenzhou;Industrials;Sparkedge Capital, Guotai Ruichengde Asset Management;;;;;;;;;;;;;;;;;;;;;;;;;;;;;;;;;;;;;;;;;;;;;;;;;;;;;;
;Amagi;US$1,40 ;3/16/22;India;Bengaluru;Media & Entertainment;Mayfield, Accel, Norwest Venture Partners;;;;;;;;;;;;;;;;;;;;;;;;;;;;;;;;;;;;;;;;;;;;;;;;;;;;;;
;Liquid Death;US$1,40 ;3/11/24;United States;Santa Monica;Consumer & Retail;Science Media, Live Nation Labs, Velvet Sea Ventures;;;;;;;;;;;;;;;;;;;;;;;;;;;;;;;;;;;;;;;;;;;;;;;;;;;;;;
;Papa;US$1,40 ;11/4/21;United States;Miami;Healthcare & Life Sciences;Initialized Capital, Canaan Partners, Sound Ventures;;;;;;;;;;;;;;;;;;;;;;;;;;;;;;;;;;;;;;;;;;;;;;;;;;;;;;
;Xpressbees;US$1,40 ;2/9/22;India;Pune;Consumer & Retail;Norwest Venture Partners, Investcorp, Blackstone;;;;;;;;;;;;;;;;;;;;;;;;;;;;;;;;;;;;;;;;;;;;;;;;;;;;;;
;Figment;US$1,40 ;12/20/21;Canada;Toronto;Financial Services;Bonfire Ventures, Two Sigma Ventures, FJ Labs;;;;;;;;;;;;;;;;;;;;;;;;;;;;;;;;;;;;;;;;;;;;;;;;;;;;;;
;Envoy;US$1,40 ;1/11/22;United States;San Francisco;Enterprise Tech;Andreessen Horowitz, Initialized Capital, TriplePoint Capital;;;;;;;;;;;;;;;;;;;;;;;;;;;;;;;;;;;;;;;;;;;;;;;;;;;;;;
;Deliverect;US$1,40 ;1/24/22;Belgium;Ghent;Consumer & Retail;Newion Partners, SmartFin Capital, OMERS Ventures;;;;;;;;;;;;;;;;;;;;;;;;;;;;;;;;;;;;;;;;;;;;;;;;;;;;;;
;SparkCognition;US$1,40 ;1/25/22;United States;Austin;Enterprise Tech;March Capital Partners, Temasek, Doha Venture Capital;;;;;;;;;;;;;;;;;;;;;;;;;;;;;;;;;;;;;;;;;;;;;;;;;;;;;;
;Liquidity;US$1,40 ;2/20/23;Israel;Tel Aviv;Financial Services;MUFG Innovation Partners, Spark Capital;;;;;;;;;;;;;;;;;;;;;;;;;;;;;;;;;;;;;;;;;;;;;;;;;;;;;;
;Firebolt;US$1,40 ;1/26/22;Israel;Tel Aviv;Enterprise Tech;TLV Partners, Zeev Ventures, Bessemer Venture Partners;;;;;;;;;;;;;;;;;;;;;;;;;;;;;;;;;;;;;;;;;;;;;;;;;;;;;;
;AI21 Labs;US$1,40 ;8/30/23;Israel;Tel Aviv;Enterprise Tech;Walden Catalyst Ventures, Pitango Venture Capital, TPY Capital;;;;;;;;;;;;;;;;;;;;;;;;;;;;;;;;;;;;;;;;;;;;;;;;;;;;;;
;Koudai;US$1,40 ;10/23/14;China;Beijing;Consumer & Retail;New Enterprise Associates, Tiger Global Management, Tencent;;;;;;;;;;;;;;;;;;;;;;;;;;;;;;;;;;;;;;;;;;;;;;;;;;;;;;
;Symphony;US$1,40 ;5/16/17;United States;New York;Financial Services;BNP Paribas, Goldman Sachs, Google;;;;;;;;;;;;;;;;;;;;;;;;;;;;;;;;;;;;;;;;;;;;;;;;;;;;;;
;Yidian Zixun;US$1,40 ;10/17/17;China;Beijing;Media & Entertainment;Phoenix New Media, Tianjin Haihe Industry Fund;;;;;;;;;;;;;;;;;;;;;;;;;;;;;;;;;;;;;;;;;;;;;;;;;;;;;;
;Cabify;US$1,40 ;1/22/18;Spain;Madrid;Industrials;Seaya Ventures, Otter Rock Capital, Rakuten;;;;;;;;;;;;;;;;;;;;;;;;;;;;;;;;;;;;;;;;;;;;;;;;;;;;;;
;Hive Box;US$1,40 ;1/23/18;China;Shenzhen;Consumer & Retail;Eastern Bell Capital, SF Holding Co, STO Express;;;;;;;;;;;;;;;;;;;;;;;;;;;;;;;;;;;;;;;;;;;;;;;;;;;;;;
;Away;US$1,40 ;5/15/19;United States;New York;Consumer & Retail;Global Founders Capital, Comcast Ventures, Forerunner Ventures;;;;;;;;;;;;;;;;;;;;;;;;;;;;;;;;;;;;;;;;;;;;;;;;;;;;;;
;Kong;US$2,00 ;12/31/20;United States;San Francisco;Enterprise Tech;New Enterprise Associates, CRV, Index Ventures;;;;;;;;;;;;;;;;;;;;;;;;;;;;;;;;;;;;;;;;;;;;;;;;;;;;;;
;Epidemic Sound;US$1,40 ;3/11/21;Sweden;Stockholm;Media & Entertainment;EQT Partners, Blackstone;;;;;;;;;;;;;;;;;;;;;;;;;;;;;;;;;;;;;;;;;;;;;;;;;;;;;;
;Yotpo;US$1,40 ;3/18/21;United States;New York;Consumer & Retail;Bessemer Venture Partners, Vintage Investment Partners, Blumberg Capital;;;;;;;;;;;;;;;;;;;;;;;;;;;;;;;;;;;;;;;;;;;;;;;;;;;;;;
;Rebel Foods;US$1,40 ;10/7/21;India;Pune;Consumer & Retail;Sequoia Capital India, Lightbox Ventures, Coatue Management;;;;;;;;;;;;;;;;;;;;;;;;;;;;;;;;;;;;;;;;;;;;;;;;;;;;;;
;Coda;US$1,40 ;7/8/21;United States;Mountain View;Enterprise Tech;Greylock Partners, General Catalyst, Khosla Ventures;;;;;;;;;;;;;;;;;;;;;;;;;;;;;;;;;;;;;;;;;;;;;;;;;;;;;;
;Stash;US$1,40 ;2/3/21;United States;New York;Financial Services;Goodwater Capital, Entree Capital, Valar Ventures;;;;;;;;;;;;;;;;;;;;;;;;;;;;;;;;;;;;;;;;;;;;;;;;;;;;;;
;Rad Power Bikes;US$1,40 ;10/28/21;United States;Seattle;Industrials;Durable Capital Partners, Cercano Management, T. Rowe Price;;;;;;;;;;;;;;;;;;;;;;;;;;;;;;;;;;;;;;;;;;;;;;;;;;;;;;
;Clarify Health;US$1,40 ;4/5/22;United States;San Francisco;Healthcare & Life Sciences;KKR, Aspenwood Ventures, Spark Capital;;;;;;;;;;;;;;;;;;;;;;;;;;;;;;;;;;;;;;;;;;;;;;;;;;;;;;
;Bucketplace;US$1,40 ;5/9/22;South Korea;Seoul;Consumer & Retail;IMM Investment, Mirae Asset Capital, BOND;;;;;;;;;;;;;;;;;;;;;;;;;;;;;;;;;;;;;;;;;;;;;;;;;;;;;;
;Paddle;US$1,40 ;5/9/22;United Kingdom;London;Enterprise Tech;Notion Capital, Kindred Capital, BGF Ventures;;;;;;;;;;;;;;;;;;;;;;;;;;;;;;;;;;;;;;;;;;;;;;;;;;;;;;
;OneCard;US$1,40 ;7/13/22;India;Pune;Financial Services;Sequoia Capital India, Hummingbird Ventures, Matrix Partners India;;;;;;;;;;;;;;;;;;;;;;;;;;;;;;;;;;;;;;;;;;;;;;;;;;;;;;
;boAT;US$1,40 ;10/28/22;India;Mumbai;Consumer & Retail;Qualcomm Ventures, Fireside Ventures;;;;;;;;;;;;;;;;;;;;;;;;;;;;;;;;;;;;;;;;;;;;;;;;;;;;;;
;Phenom People;US$1,40 ;4/7/21;United States;Ambler;Enterprise Tech;Sierra Ventures, AXA Venture Partners, Sigma Prime Ventures;;;;;;;;;;;;;;;;;;;;;;;;;;;;;;;;;;;;;;;;;;;;;;;;;;;;;;
;GupShup;US$1,40 ;4/8/21;United States;San Francisco;Enterprise Tech;Helion Venture Partners, Tiger Global management, CRV;;;;;;;;;;;;;;;;;;;;;;;;;;;;;;;;;;;;;;;;;;;;;;;;;;;;;;
;Degreed;US$1,40 ;4/13/21;United States;Pleasanton;Enterprise Tech;Signal Peak Ventures, Owl Ventures, Jump Capital;;;;;;;;;;;;;;;;;;;;;;;;;;;;;;;;;;;;;;;;;;;;;;;;;;;;;;
;Scalable Capital;US$1,40 ;6/8/21;Germany;Munich;Financial Services;BlackRock, Tengelmann Ventures, Holtzbrinck Ventures;;;;;;;;;;;;;;;;;;;;;;;;;;;;;;;;;;;;;;;;;;;;;;;;;;;;;;
;VideoAmp;US$1,40 ;10/21/21;United States;Los Angeles;Enterprise Tech;Simon Equity Partners, Wavemaker Partners, Anthem Venture Partners;;;;;;;;;;;;;;;;;;;;;;;;;;;;;;;;;;;;;;;;;;;;;;;;;;;;;;
;Panther Labs;US$1,40 ;12/2/21;United States;San Francisco;Enterprise Tech;Innovation Endeavors, s28 Capital, Lightspeed Venture Partners;;;;;;;;;;;;;;;;;;;;;;;;;;;;;;;;;;;;;;;;;;;;;;;;;;;;;;
;Salt Security;US$1,40 ;2/10/22;United States;Palo Alto;Enterprise Tech;Y Combinator, S Capital, Tenaya Capital;;;;;;;;;;;;;;;;;;;;;;;;;;;;;;;;;;;;;;;;;;;;;;;;;;;;;;
;Tripledot;US$1,40 ;2/14/22;United Kingdom;London;Media & Entertainment;Lightspeed Venture Partners, Access Industries, Eldridge;;;;;;;;;;;;;;;;;;;;;;;;;;;;;;;;;;;;;;;;;;;;;;;;;;;;;;
;Nimble Rx;US$1,40 ;6/14/22;United States;Redwood City;Healthcare & Life Sciences;Sequoia Capital, Four Rivers Group, DAG Ventures;;;;;;;;;;;;;;;;;;;;;;;;;;;;;;;;;;;;;;;;;;;;;;;;;;;;;;
;Veepee;US$1,38 ;7/2/07;France;La Plaine Saint-Denis;Consumer & Retail;Summit Partners, Qatar Holding;;;;;;;;;;;;;;;;;;;;;;;;;;;;;;;;;;;;;;;;;;;;;;;;;;;;;;
;Neon;US$1,38 ;2/14/22;Brazil;Sao Paulo;Financial Services;Propel Venture Partners, Monashees+, BBVA;;;;;;;;;;;;;;;;;;;;;;;;;;;;;;;;;;;;;;;;;;;;;;;;;;;;;;
;Movable Ink;US$1,36 ;4/28/22;United States;New York;Enterprise Tech;Contour Venture Partners, Intel Capital, Silver Lake;;;;;;;;;;;;;;;;;;;;;;;;;;;;;;;;;;;;;;;;;;;;;;;;;;;;;;
;Patreon;US$1,35 ;9/2/20;United States;San Francisco;Media & Entertainment;Index Ventures, Thrive Capital, CRV;;;;;;;;;;;;;;;;;;;;;;;;;;;;;;;;;;;;;;;;;;;;;;;;;;;;;;
