;Lucid Software;US$3,00 ;6/29/21;United States;South Jordan;Enterprise Tech;Spectrum Equity, ICONIQ Capital, Grayhawk Capital;;;;;;;;;;;;;;;;;;;;;;;;;;;;;;;;;;;;;;;;;;;;;;;;;;;;;;
;Age of Learning;US$3,00 ;5/3/16;United States;Glendale;Consumer & Retail;Iconiq Capital;;;;;;;;;;;;;;;;;;;;;;;;;;;;;;;;;;;;;;;;;;;;;;;;;;;;;;
;Zetwerk;US$3,00 ;8/20/21;India;Bengaluru;Industrials;Sequoia Capital India, Kae Capital, Accel;;;;;;;;;;;;;;;;;;;;;;;;;;;;;;;;;;;;;;;;;;;;;;;;;;;;;;
;Carbon Health;US$3,00 ;7/21/21;United States;San Francisco;Healthcare & Life Sciences;Brookfield Asset Management, Blackstone, Data Collective;;;;;;;;;;;;;;;;;;;;;;;;;;;;;;;;;;;;;;;;;;;;;;;;;;;;;;
;Contentful;US$3,00 ;7/28/21;Germany;Berlin;Enterprise Tech;Balderton Capital, General Catalyst, Tiger Global Management;;;;;;;;;;;;;;;;;;;;;;;;;;;;;;;;;;;;;;;;;;;;;;;;;;;;;;
;LaunchDarkly;US$3,00 ;8/10/21;United States;Oakland;Enterprise Tech;Uncork Capital, Threshold Ventures, Bloomberg Beta;;;;;;;;;;;;;;;;;;;;;;;;;;;;;;;;;;;;;;;;;;;;;;;;;;;;;;
;Seismic;US$3,00 ;12/18/18;United States;San Diego;Enterprise Tech;Jackson Square Ventures, General Atlantic, Lightspeed Venture Partners;;;;;;;;;;;;;;;;;;;;;;;;;;;;;;;;;;;;;;;;;;;;;;;;;;;;;;
;Sky Mavis;US$3,00 ;10/4/21;Vietnam;Ho Chi Minh City;Media & Entertainment;Fabric Ventures, 500 Global, Standard Crypto;;;;;;;;;;;;;;;;;;;;;;;;;;;;;;;;;;;;;;;;;;;;;;;;;;;;;;
;Outschool;US$3,00 ;4/14/21;United States;San Francisco;Consumer & Retail;Uniion Square Ventures, Tiger Global Management, Lightspeed Venture Capital;;;;;;;;;;;;;;;;;;;;;;;;;;;;;;;;;;;;;;;;;;;;;;;;;;;;;;
;TradingView;US$3,00 ;10/14/21;United States;Westerville;Financial Services;Tiger Global Management, Insight Partners, Jump Capital;;;;;;;;;;;;;;;;;;;;;;;;;;;;;;;;;;;;;;;;;;;;;;;;;;;;;;
;Groww;US$3,00 ;4/7/21;India;Bengaluru;Financial Services;Tiger Global Management, Sequoia Capital India, Ribbit Capital;;;;;;;;;;;;;;;;;;;;;;;;;;;;;;;;;;;;;;;;;;;;;;;;;;;;;;
;Podium;US$3,00 ;4/7/20;United States;Lehi;Consumer & Retail;Accel, Summit Partners, Google Ventures;;;;;;;;;;;;;;;;;;;;;;;;;;;;;;;;;;;;;;;;;;;;;;;;;;;;;;
;Via;US$3,50 ;3/30/20;United States;New York;Industrials;83North, RiverPark Ventures, Pitango Venture Capital;;;;;;;;;;;;;;;;;;;;;;;;;;;;;;;;;;;;;;;;;;;;;;;;;;;;;;
;Anchorage Digital;US$3,00 ;12/15/21;United States;San Francisco;Financial Services;Andreessen Horowitz, Blockchain Capital, Lux Capital;;;;;;;;;;;;;;;;;;;;;;;;;;;;;;;;;;;;;;;;;;;;;;;;;;;;;;
;Inxeption;US$3,00 ;1/13/22;United States;San Francisco;Industrials;Coatue Management, BMO Capital, Schonfeld Strategic Advisors;;;;;;;;;;;;;;;;;;;;;;;;;;;;;;;;;;;;;;;;;;;;;;;;;;;;;;
;Lattice;US$3,00 ;3/23/21;United States;San Francisco;Enterprise Tech;Khosla Ventures, Thrive Capital, Y Combinator;;;;;;;;;;;;;;;;;;;;;;;;;;;;;;;;;;;;;;;;;;;;;;;;;;;;;;
;Flutterwave;US$3,00 ;3/9/21;United States;San Francisco;Financial Services;Green Visor Capital, CRE Venture Capital, Greycroft;;;;;;;;;;;;;;;;;;;;;;;;;;;;;;;;;;;;;;;;;;;;;;;;;;;;;;
;Cross River Bank;US$3,00 ;2/11/22;United States;Fort Lee;Financial Services;Battery Ventures, Andreessen Horowitz, Ribbit Capital;;;;;;;;;;;;;;;;;;;;;;;;;;;;;;;;;;;;;;;;;;;;;;;;;;;;;;
;Remote;US$3,00 ;7/13/21;United States;San Francisco;Enterprise Tech;Index Ventures, Sequoia Capital, General Catalyst;;;;;;;;;;;;;;;;;;;;;;;;;;;;;;;;;;;;;;;;;;;;;;;;;;;;;;
;Sentry;US$3,00 ;2/18/21;United States;San Francisco;Enterprise Tech;New Enterprise Associates, Accel, Bond;;;;;;;;;;;;;;;;;;;;;;;;;;;;;;;;;;;;;;;;;;;;;;;;;;;;;;
;TERMINUS Technology;US$2,96 ;10/25/18;China;Beijing;Industrials;China Everbright Limited, IDG Capital, iFLYTEK;;;;;;;;;;;;;;;;;;;;;;;;;;;;;;;;;;;;;;;;;;;;;;;;;;;;;;
;Kraken;US$2,92 ;6/25/19;United States;San Francisco;Financial Services;Bnk To The Future, Trammell Ventures, SBI Investment;;;;;;;;;;;;;;;;;;;;;;;;;;;;;;;;;;;;;;;;;;;;;;;;;;;;;;
;Workrise;US$2,90 ;9/30/19;United States;Austin;Industrials;Founders Fund, Quantum Energy Partners, Bedrock Capital;;;;;;;;;;;;;;;;;;;;;;;;;;;;;;;;;;;;;;;;;;;;;;;;;;;;;;
;BharatPe;US$2,85 ;7/30/21;India;New Delhi;Financial Services;Insight Partners, Sequoia Capital India, BEENEXT;;;;;;;;;;;;;;;;;;;;;;;;;;;;;;;;;;;;;;;;;;;;;;;;;;;;;;
;Gokin Solar;US$2,88 ;4/13/22;China;Zhuhai;Industrials;IDG Capital, Puluo Capital, Midea Capital;;;;;;;;;;;;;;;;;;;;;;;;;;;;;;;;;;;;;;;;;;;;;;;;;;;;;;
;DriveWealth;US$2,85 ;8/20/21;United States;Chatham;Financial Services;Point72 Ventures, Route 66 Ventures, Accel;;;;;;;;;;;;;;;;;;;;;;;;;;;;;;;;;;;;;;;;;;;;;;;;;;;;;;
;Meicai;US$2,80 ;6/22/16;China;Beijing;Consumer & Retail;Tiger Global Management, Blue Lake Capital, ZhenFund;;;;;;;;;;;;;;;;;;;;;;;;;;;;;;;;;;;;;;;;;;;;;;;;;;;;;;
;Physical Intelligence;US$2,80 ;11/4/24;United States;San Francisco;Enterprise Tech;Khosla Ventures, Sequoia Capital, Lux Capital;;;;;;;;;;;;;;;;;;;;;;;;;;;;;;;;;;;;;;;;;;;;;;;;;;;;;;
;Nutrabolt;US$2,79 ;12/8/22;United States;Austin;Consumer & Retail;MidOcean Partners;;;;;;;;;;;;;;;;;;;;;;;;;;;;;;;;;;;;;;;;;;;;;;;;;;;;;;
;Baichuan AI;US$2,77 ;10/17/23;China;Haidian;Enterprise Tech;Shenzhen Capital Group, Shunwei Capital;;;;;;;;;;;;;;;;;;;;;;;;;;;;;;;;;;;;;;;;;;;;;;;;;;;;;;
;Illumio;US$2,75 ;4/14/15;United States;Sunnyvale;Enterprise Tech;Data Collective, Formation 8, General Catalyst Partners;;;;;;;;;;;;;;;;;;;;;;;;;;;;;;;;;;;;;;;;;;;;;;;;;;;;;;
;MasterClass;US$2,75 ;5/13/21;United States;San Francisco;Media & Entertainment;Institutional Venture Partners, New Enterprise Associates, Javelin Venture Partners;;;;;;;;;;;;;;;;;;;;;;;;;;;;;;;;;;;;;;;;;;;;;;;;;;;;;;
;Dream Games;US$2,75 ;6/30/21;Turkey;Istanbul;Media & Entertainment;Makers Fund, Index Ventures, Inova Ventures Participacees;;;;;;;;;;;;;;;;;;;;;;;;;;;;;;;;;;;;;;;;;;;;;;;;;;;;;;
;Transmit Security;US$2,74 ;6/22/21;Israel;Tel Aviv;Enterprise Tech;General Atlantic, Insight Partners, Vintage Investment Partners;;;;;;;;;;;;;;;;;;;;;;;;;;;;;;;;;;;;;;;;;;;;;;;;;;;;;;
;Hozon Auto;US$3,95 ;2/22/22;China;Shanghai;Industrials;HD Capital, Qihoo 360 Technology, China Fortune Land Development;;;;;;;;;;;;;;;;;;;;;;;;;;;;;;;;;;;;;;;;;;;;;;;;;;;;;;
;Tradeshift;US$2,70 ;5/30/18;United States;San Francisco;Enterprise Tech;Notion Capital, Scentan Ventures, Kite Ventures;;;;;;;;;;;;;;;;;;;;;;;;;;;;;;;;;;;;;;;;;;;;;;;;;;;;;;
;Nextiva;US$2,70 ;9/14/21;United States;Scottsdale;Enterprise Tech;Goldman Sachs Asset Management;;;;;;;;;;;;;;;;;;;;;;;;;;;;;;;;;;;;;;;;;;;;;;;;;;;;;;
;Tridge;US$2,70 ;8/24/22;South Korea;Seoul;Industrials;Forest Partners, Softbank Ventures Asia;;;;;;;;;;;;;;;;;;;;;;;;;;;;;;;;;;;;;;;;;;;;;;;;;;;;;;
;Thought Machine;US$2,70 ;11/29/21;United Kingdom;London;Financial Services;British Patient Capital, SEB Venture Capital, IQ Capital;;;;;;;;;;;;;;;;;;;;;;;;;;;;;;;;;;;;;;;;;;;;;;;;;;;;;;
;Starling Bank;US$2,69 ;3/8/21;United Kingdom;London;Financial Services;JTC Group, Qatar Investment Authority, Fidelity Investment;;;;;;;;;;;;;;;;;;;;;;;;;;;;;;;;;;;;;;;;;;;;;;;;;;;;;;
;Figure;US$2,68 ;2/23/24;United States;Sunnyvale;Industrials;Intel Capital, Parkway VC, Amazon Industrial Innovation Fund;;;;;;;;;;;;;;;;;;;;;;;;;;;;;;;;;;;;;;;;;;;;;;;;;;;;;;
;BackBase;US$2,66 ;6/9/22;Netherlands;Amsterdam;Financial Services;Motive Partners;;;;;;;;;;;;;;;;;;;;;;;;;;;;;;;;;;;;;;;;;;;;;;;;;;;;;;
;ManoMano;US$2,60 ;7/5/21;France;Paris;Consumer & Retail;General Atlantic, Piton Capital, Partech Partners;;;;;;;;;;;;;;;;;;;;;;;;;;;;;;;;;;;;;;;;;;;;;;;;;;;;;;
;Sourcegraph;US$2,62 ;7/13/21;United States;San Francisco;Enterprise Tech;Redpoint Ventures, Goldcrest Capital, Insight Partners;;;;;;;;;;;;;;;;;;;;;;;;;;;;;;;;;;;;;;;;;;;;;;;;;;;;;;
;Pendo;US$2,60 ;10/17/19;United States;Raleigh;Enterprise Tech;Contour Venture Partners, Battery Ventures, Core Capital Partners;;;;;;;;;;;;;;;;;;;;;;;;;;;;;;;;;;;;;;;;;;;;;;;;;;;;;;
;Cursor;US$2,60 ;12/20/24;United States;San Francisco;Enterprise Tech;Andreessen Horowitz, Thrive Capital, OpenAI Startup Fund;;;;;;;;;;;;;;;;;;;;;;;;;;;;;;;;;;;;;;;;;;;;;;;;;;;;;;
;Plume;US$2,60 ;2/23/21;United States;Palo Alto;Industrials;Insight Partners, Jackson Square Ventures, Liberty Gloval Ventures;;;;;;;;;;;;;;;;;;;;;;;;;;;;;;;;;;;;;;;;;;;;;;;;;;;;;;
;Moglix;US$2,60 ;5/17/21;Singapore;;Industrials;Jungle Ventures, Accel, Venture Highway;;;;;;;;;;;;;;;;;;;;;;;;;;;;;;;;;;;;;;;;;;;;;;;;;;;;;;
;Axonius;US$2,60 ;3/1/21;United States;New York;Enterprise Tech;Vertex Ventures Israel, Bessemer Venture Partners, Emerge;;;;;;;;;;;;;;;;;;;;;;;;;;;;;;;;;;;;;;;;;;;;;;;;;;;;;;
;Xinchao Media;US$2,00 ;4/9/18;China;Chengdu;Media & Entertainment;JD.com, Baidu, Vision Plus Capital;;;;;;;;;;;;;;;;;;;;;;;;;;;;;;;;;;;;;;;;;;;;;;;;;;;;;;
;JumpCloud;US$2,62 ;9/13/21;United States;Louisville;Enterprise Tech;Foundry Group, General Atlantic, BlackRock;;;;;;;;;;;;;;;;;;;;;;;;;;;;;;;;;;;;;;;;;;;;;;;;;;;;;;
;Unico;US$2,60 ;8/3/21;Brazil;Sao Paulo;Enterprise Tech;Big Bets, General Atlantic, SOFTBANK Latin America Ventures;;;;;;;;;;;;;;;;;;;;;;;;;;;;;;;;;;;;;;;;;;;;;;;;;;;;;;
;Bending Spoons;US$2,55 ;2/15/24;Italy;Milan;Consumer & Retail;Durable Capital Partners, Adjacent, Creator Partners;;;;;;;;;;;;;;;;;;;;;;;;;;;;;;;;;;;;;;;;;;;;;;;;;;;;;;
;JUST Egg;US$2,59 ;11/30/17;United States;San Francisco;Consumer & Retail;Khosla Ventures, Horizons Ventures, Founders Fund;;;;;;;;;;;;;;;;;;;;;;;;;;;;;;;;;;;;;;;;;;;;;;;;;;;;;;
;Groq;US$2,50 ;4/14/21;United States;Mountain View;Enterprise Tech;TDK Ventures, Social Capital, D1 Capital Partners;;;;;;;;;;;;;;;;;;;;;;;;;;;;;;;;;;;;;;;;;;;;;;;;;;;;;;
;Jetti Resources;US$2,50 ;10/24/22;United States;Boulder;Industrials;BMW i Ventures, BHP Ventures;;;;;;;;;;;;;;;;;;;;;;;;;;;;;;;;;;;;;;;;;;;;;;;;;;;;;;
;Claroty;US$2,50 ;6/17/21;United States;New York;Enterprise Tech;Bessemer Venture Partners, MoreVC, Team8;;;;;;;;;;;;;;;;;;;;;;;;;;;;;;;;;;;;;;;;;;;;;;;;;;;;;;
;Vista Global;US$2,50 ;8/23/17;United Arab Emirates;Dubai;Industrials;Rhone Capital;;;;;;;;;;;;;;;;;;;;;;;;;;;;;;;;;;;;;;;;;;;;;;;;;;;;;;
;BYTON;US$2,50 ;4/20/18;China;Nanjing;Industrials;FAW Group, Tencent Holdings, Tus Holdings;;;;;;;;;;;;;;;;;;;;;;;;;;;;;;;;;;;;;;;;;;;;;;;;;;;;;;
;Side;US$2,50 ;3/22/21;United States;San Francisco;Financial Services;Coatue Managemeny, Trinity Ventures, Matrix Partners;;;;;;;;;;;;;;;;;;;;;;;;;;;;;;;;;;;;;;;;;;;;;;;;;;;;;;
;Infra.Market;US$2,50 ;2/25/21;India;Thane;Industrials;Accel, Tiger Global Management, Nexus Venture Partners;;;;;;;;;;;;;;;;;;;;;;;;;;;;;;;;;;;;;;;;;;;;;;;;;;;;;;
;Varo Bank;US$2,50 ;9/9/21;United States;San Francisco;Financial Services;Warburg Pincus, The Rise Fund, HarbourVest Partners;;;;;;;;;;;;;;;;;;;;;;;;;;;;;;;;;;;;;;;;;;;;;;;;;;;;;;
;Cato Networks;US$3,00 ;11/17/20;Israel;Tel Aviv;Enterprise Tech;Aspect Ventures, SingTel Innov8, Greylock Partners;;;;;;;;;;;;;;;;;;;;;;;;;;;;;;;;;;;;;;;;;;;;;;;;;;;;;;
;Sword Health;US$3,00 ;11/22/21;United States;New York;Healthcare & Life Sciences;Khosla Ventures, Green Innovations, Founders Fund;;;;;;;;;;;;;;;;;;;;;;;;;;;;;;;;;;;;;;;;;;;;;;;;;;;;;;
;Aura;US$2,50 ;6/9/21;United States;Burlington;Consumer & Retail;Warburg Pincus, General Catalyst;;;;;;;;;;;;;;;;;;;;;;;;;;;;;;;;;;;;;;;;;;;;;;;;;;;;;;
;TensTorrent;US$2,60 ;5/5/21;Canada;Toronto;Enterprise Tech;Eclipse Ventures, Fidelity Investments, Moore Capital Management;;;;;;;;;;;;;;;;;;;;;;;;;;;;;;;;;;;;;;;;;;;;;;;;;;;;;;
;Sysdig;US$2,50 ;4/28/21;United States;San Francisco;Enterprise Tech;Accel, Bain Capital Ventures, Insight Partners;;;;;;;;;;;;;;;;;;;;;;;;;;;;;;;;;;;;;;;;;;;;;;;;;;;;;;
;Uniphore;US$2,50 ;2/16/22;United States;Palo Alto;Enterprise Tech;Chiratae Ventures, March Capital Partners, National Grid Partners;;;;;;;;;;;;;;;;;;;;;;;;;;;;;;;;;;;;;;;;;;;;;;;;;;;;;;
;Somatus;US$2,50 ;2/23/22;United States;McLean;Healthcare & Life Sciences;The Blue Venture Fund, Flare Capital Partners, Longitude Capital;;;;;;;;;;;;;;;;;;;;;;;;;;;;;;;;;;;;;;;;;;;;;;;;;;;;;;
;Immutable;US$2,50 ;3/7/22;Australia;Sydney;Media & Entertainment;Fabric Ventures, AirTree Ventures, Temasek;;;;;;;;;;;;;;;;;;;;;;;;;;;;;;;;;;;;;;;;;;;;;;;;;;;;;;
;SiFive;US$2,50 ;3/16/22;United States;San Mateo;Enterprise Tech;Sutter Hill Ventures, Osage University Partners, Spark Capital;;;;;;;;;;;;;;;;;;;;;;;;;;;;;;;;;;;;;;;;;;;;;;;;;;;;;;
;Games24x7;US$2,50 ;3/30/22;India;Mumbai;Media & Entertainment;Tiger Global Management, The Raine Group, Malabar Investments;;;;;;;;;;;;;;;;;;;;;;;;;;;;;;;;;;;;;;;;;;;;;;;;;;;;;;
;Fetch;US$2,50 ;3/31/21;United States;Madison;Consumer & Retail;Greycroft, Loeb.NYC, DST Global;;;;;;;;;;;;;;;;;;;;;;;;;;;;;;;;;;;;;;;;;;;;;;;;;;;;;;
;Coda Payments;US$2,50 ;4/15/22;Singapore;;Financial Services;GIC. Apis Partners, Insight Partners;;;;;;;;;;;;;;;;;;;;;;;;;;;;;;;;;;;;;;;;;;;;;;;;;;;;;;
;DriveNets;US$2,50 ;1/27/21;Israel;Ra'anana;Enterprise Tech;Bessemer Venture Partners, Pitango Venture Capital, D1 Capital Partners;;;;;;;;;;;;;;;;;;;;;;;;;;;;;;;;;;;;;;;;;;;;;;;;;;;;;;
;Hibob;US$2,45 ;10/12/21;Israel;Tel Aviv;Enterprise Tech;Bessemer Venture Partners, Eight Roads Ventures, Battery Ventures;;;;;;;;;;;;;;;;;;;;;;;;;;;;;;;;;;;;;;;;;;;;;;;;;;;;;;
;Vanta;US$2,45 ;6/7/22;United States;San Francisco;Enterprise Tech;Craft Ventures, Sequoia Capital, Verissimo Ventures;;;;;;;;;;;;;;;;;;;;;;;;;;;;;;;;;;;;;;;;;;;;;;;;;;;;;;
;Mobile Premier League;US$2,45 ;9/15/21;India;Bengaluru;Media & Entertainment;Sequoia Capital India, RTP Global, Go-Ventures;;;;;;;;;;;;;;;;;;;;;;;;;;;;;;;;;;;;;;;;;;;;;;;;;;;;;;
;insitro;US$2,44 ;3/15/21;United States;South San Francisco;Healthcare & Life Sciences;Foresite Capital, ARCH Venture Partners, Third Rock Ventures;;;;;;;;;;;;;;;;;;;;;;;;;;;;;;;;;;;;;;;;;;;;;;;;;;;;;;
;Cgtz;US$2,41 ;2/21/17;China;Hangzhou;Financial Services;Shunwei Capital Partners, China Media Group, Guangzhou Huiyin Aofeng Equity Investment Fund;;;;;;;;;;;;;;;;;;;;;;;;;;;;;;;;;;;;;;;;;;;;;;;;;;;;;;
;Star Charge;US$2,41 ;5/19/21;China;Changzhou;Industrials;Shunwei Capital Partners, China Media Group, Guangzhou Huiyin Aofeng Equity Investment Fund;;;;;;;;;;;;;;;;;;;;;;;;;;;;;;;;;;;;;;;;;;;;;;;;;;;;;;
;Carbon;US$2,40 ;8/20/15;United States;Redwood City;Industrials;Google Ventures, Sequoia Capital, Wakefield Group;;;;;;;;;;;;;;;;;;;;;;;;;;;;;;;;;;;;;;;;;;;;;;;;;;;;;;
;Rokt;US$2,40 ;12/16/21;United States;New York;Consumer & Retail;Square Peg Capital, TDM Growth Partners, Tiger Global Management;;;;;;;;;;;;;;;;;;;;;;;;;;;;;;;;;;;;;;;;;;;;;;;;;;;;;;
;Paxos;US$2,40 ;4/29/21;United States;New York;Financial Services;Liberty City Ventures, RRE Ventures, Mithril Capital Management;;;;;;;;;;;;;;;;;;;;;;;;;;;;;;;;;;;;;;;;;;;;;;;;;;;;;;
;BitSight Technologies;US$2,40 ;9/13/21;United States;Boston;Enterprise Tech;Menlo Ventures, GGV Capital, Flybridge Capital Partners;;;;;;;;;;;;;;;;;;;;;;;;;;;;;;;;;;;;;;;;;;;;;;;;;;;;;;
;Trumid;US$2,40 ;7/15/20;United States;New York;Financial Services;T. Rowe Price, Dragoneer Investment Group, BlackRock;;;;;;;;;;;;;;;;;;;;;;;;;;;;;;;;;;;;;;;;;;;;;;;;;;;;;;
;ABL Space Systems;US$2,40 ;3/25/21;United States;El Segundo;Industrials;T. Rowe Price, Lockheed Martin Ventures, Fidelity Investment;;;;;;;;;;;;;;;;;;;;;;;;;;;;;;;;;;;;;;;;;;;;;;;;;;;;;;
;HoneyBook;US$2,40 ;5/4/21;United States;San Francisco;Enterprise Tech;Norwest Venture Partners, Hillsven Capital, Aleph;;;;;;;;;;;;;;;;;;;;;;;;;;;;;;;;;;;;;;;;;;;;;;;;;;;;;;
;Beta Technologies;US$2,40 ;4/19/22;United States;South Burlington;Industrials;The Rise Fund, Fidelity Investments. RedBird Capital Partners;;;;;;;;;;;;;;;;;;;;;;;;;;;;;;;;;;;;;;;;;;;;;;;;;;;;;;
;Project44;US$2,62 ;6/1/21;United States;Chicago;Enterprise Tech;Emergence Capital Partners, 8VC, Chicago Ventures;;;;;;;;;;;;;;;;;;;;;;;;;;;;;;;;;;;;;;;;;;;;;;;;;;;;;;
;Freenome;US$2,62 ;8/26/20;United States;South San Francisco;Healthcare & Life Sciences;Andreessen Horowitz, Data Collective, Roche Venture Fund;;;;;;;;;;;;;;;;;;;;;;;;;;;;;;;;;;;;;;;;;;;;;;;;;;;;;;
;ManyPets;US$2,35 ;6/1/21;United Kingdom;London;Insurance;Octopus Ventures, Munich Re Ventures, CommerzVentures;;;;;;;;;;;;;;;;;;;;;;;;;;;;;;;;;;;;;;;;;;;;;;;;;;;;;;
;Jobandtalent;US$2,35 ;12/1/21;Spain;Madrid;Enterprise Tech;Kibo Ventures, SoftBank Group, Atomico;;;;;;;;;;;;;;;;;;;;;;;;;;;;;;;;;;;;;;;;;;;;;;;;;;;;;;
;WEMAKEPRICE;US$2,34 ;9/9/15;South Korea;Seoul;Consumer & Retail;IMM Investment, NXC;;;;;;;;;;;;;;;;;;;;;;;;;;;;;;;;;;;;;;;;;;;;;;;;;;;;;;
;Biren Technology;US$2,32 ;8/18/20;China;Shanghai;Enterprise Tech;V FUND, IDG Capital, Green Pine Capital Partners;;;;;;;;;;;;;;;;;;;;;;;;;;;;;;;;;;;;;;;;;;;;;;;;;;;;;;
;Transcarent;US$2,20 ;1/11/22;United States;San Francisco;Healthcare & Life Sciences;Alta Partners, General Catalyst, Jove Equity Partners;;;;;;;;;;;;;;;;;;;;;;;;;;;;;;;;;;;;;;;;;;;;;;;;;;;;;;
;Voodoo;US$2,31 ;8/17/20;France;Paris;Media & Entertainment;Tencent Holdings, Goldman Sachs;;;;;;;;;;;;;;;;;;;;;;;;;;;;;;;;;;;;;;;;;;;;;;;;;;;;;;
;Shield AI;US$2,80 ;8/24/21;United States;San Diego;Industrials;Andreessen Horowitz, Homebrew, Point72 Ventures;;;;;;;;;;;;;;;;;;;;;;;;;;;;;;;;;;;;;;;;;;;;;;;;;;;;;;
;PhysicsWallah;US$2,80 ;6/7/22;India;Uttar Pradesh;Consumer & Retail;GSV Ventures, WestBridge Capital;;;;;;;;;;;;;;;;;;;;;;;;;;;;;;;;;;;;;;;;;;;;;;;;;;;;;;
;Uptake;US$2,30 ;10/27/15;United States;Chicago;Industrials;Revolution, New Enterprise Associates, Caterpillar;;;;;;;;;;;;;;;;;;;;;;;;;;;;;;;;;;;;;;;;;;;;;;;;;;;;;;
;Motive;US$2,85 ;4/23/19;United States;San Francisco;Industrials;Google Ventures, Index Ventures, Scale Venture Partners;;;;;;;;;;;;;;;;;;;;;;;;;;;;;;;;;;;;;;;;;;;;;;;;;;;;;;
;Greenlight;US$2,30 ;9/24/20;United States;Atlanta;Financial Services;Relay Ventures, TTV Capital, Canapi Ventures;;;;;;;;;;;;;;;;;;;;;;;;;;;;;;;;;;;;;;;;;;;;;;;;;;;;;;
;MoMo;US$2,27 ;12/10/21;Vietnam;Ho Chi Minh City;Financial Services;Goodwater Capital, Warburg Pincus, GS Growth;;;;;;;;;;;;;;;;;;;;;;;;;;;;;;;;;;;;;;;;;;;;;;;;;;;;;;
;Story Protocol;US$2,25 ;8/21/24;United States;Bellevue;Media & Entertainment;A16z Crypto, Andreessen Horowitz, Two Small Fish Ventures;;;;;;;;;;;;;;;;;;;;;;;;;;;;;;;;;;;;;;;;;;;;;;;;;;;;;;
;Algolia;US$2,25 ;7/28/21;United States;San Francisco;Enterprise Tech;Accel, Alven Capital, Storm Ventures;;;;;;;;;;;;;;;;;;;;;;;;;;;;;;;;;;;;;;;;;;;;;;;;;;;;;;
;Pattern;US$2,25 ;10/6/21;United States;Lehi;Consumer & Retail;Knox Lane, Ainge Advisory, Carlson Private Capital Partners;;;;;;;;;;;;;;;;;;;;;;;;;;;;;;;;;;;;;;;;;;;;;;;;;;;;;;
;Newfront Insurance;US$2,20 ;4/12/22;United States;San Francisco;Insurance;Founders Fund, Meritech Capital Partners, GS Growth;;;;;;;;;;;;;;;;;;;;;;;;;;;;;;;;;;;;;;;;;;;;;;;;;;;;;;
;NuCom Group;US$2,20 ;2/22/18;Germany;Unterfoehring;Consumer & Retail;General Atlantic;;;;;;;;;;;;;;;;;;;;;;;;;;;;;;;;;;;;;;;;;;;;;;;;;;;;;;
;Skydio;US$2,20 ;2/25/21;United States;Redwood City;Industrials;Andreessen Horowitz, Andreessen Horowitz, Institutional Venture Partners, Accel;;;;;;;;;;;;;;;;;;;;;;;;;;;;;;;;;;;;;;;;;;;;;;;;;;;;;;
;Uala;US$2,75 ;8/13/21;Argentina;Buenos Aires;Financial Services;Soros Fund Management, Ribbit Capital, Monashees+;;;;;;;;;;;;;;;;;;;;;;;;;;;;;;;;;;;;;;;;;;;;;;;;;;;;;;
;Current;US$2,20 ;4/27/21;United States;New York;Financial Services;Expa, QED Investors, Foundation Capital;;;;;;;;;;;;;;;;;;;;;;;;;;;;;;;;;;;;;;;;;;;;;;;;;;;;;;
;Bitso;US$2,20 ;5/5/21;Mexico;Mexico City;Financial Services;Pantera Capital, QED Investors, Coinbase Ventures;;;;;;;;;;;;;;;;;;;;;;;;;;;;;;;;;;;;;;;;;;;;;;;;;;;;;;
;Gympass;US$2,40 ;6/12/19;United States;New York;Healthcare & Life Sciences;General Atlantic, SoftBank Group, Atomico;;;;;;;;;;;;;;;;;;;;;;;;;;;;;;;;;;;;;;;;;;;;;;;;;;;;;;
;Dialpad;US$2,20 ;10/6/20;United States;San Francisco;Enterprise Tech;Andreessen Horowitz, Google Ventures, Section 32;;;;;;;;;;;;;;;;;;;;;;;;;;;;;;;;;;;;;;;;;;;;;;;;;;;;;;
;G7 Networks;US$2,20 ;2/15/22;China;Beijing;Industrials;Eastern Bell Capital 32, SDIC CMC Investment Management, Trustbridge Partners;;;;;;;;;;;;;;;;;;;;;;;;;;;;;;;;;;;;;;;;;;;;;;;;;;;;;;
;BloomReach;US$2,20 ;2/23/22;United States;Mountain View;Consumer & Retail;Bain Capital Ventures, Sixth Street Growth, Lightspeed Venture Partners;;;;;;;;;;;;;;;;;;;;;;;;;;;;;;;;;;;;;;;;;;;;;;;;;;;;;;
;Motif FoodWorks;US$2,20 ;6/16/21;United States;Boston;Industrials;General Atlantic, Breakthrough Energy Ventures, Viking Global Investors;;;;;;;;;;;;;;;;;;;;;;;;;;;;;;;;;;;;;;;;;;;;;;;;;;;;;;
;Accelerant;US$2,40 ;1/12/22;United Kingdom;Colchester;Insurance;Deer Park Road, Altamont Capital Partners, Eldridge;;;;;;;;;;;;;;;;;;;;;;;;;;;;;;;;;;;;;;;;;;;;;;;;;;;;;;
;YITU Technology;US$2,17 ;3/8/18;China;Shanghai;Enterprise Tech;Sequoia Capital China, Banyan Capital;;;;;;;;;;;;;;;;;;;;;;;;;;;;;;;;;;;;;;;;;;;;;;;;;;;;;;
;Addepar;US$2,17 ;6/15/21;United States;Mountain View;Financial Services;8VC, D1 Capital Partners, Sway Ventures;;;;;;;;;;;;;;;;;;;;;;;;;;;;;;;;;;;;;;;;;;;;;;;;;;;;;;
;Qualia;US$2,17 ;12/21/20;United States;San Francisco;Financial Services;8VC, Menlo Ventures, Tiger Global Management;;;;;;;;;;;;;;;;;;;;;;;;;;;;;;;;;;;;;;;;;;;;;;;;;;;;;;
;Neo4j;US$2,00 ;6/17/21;United States;San Mateo;Enterprise Tech;Eight Roads Ventures, One Peak Partners, Creandum;;;;;;;;;;;;;;;;;;;;;;;;;;;;;;;;;;;;;;;;;;;;;;;;;;;;;;
;CloudWalk;US$2,15 ;9/8/21;Brazil;Sao Paulo;Financial Services;Plug and Play Ventures, Valor Capital Group, DST Global;;;;;;;;;;;;;;;;;;;;;;;;;;;;;;;;;;;;;;;;;;;;;;;;;;;;;;
;Xaira Therapeutics;US$2,15 ;4/23/24;United States;San Francisco;Healthcare & Life Sciences;ARCH Venture Partners, Foresite Capital, Two Sigma Ventures;;;;;;;;;;;;;;;;;;;;;;;;;;;;;;;;;;;;;;;;;;;;;;;;;;;;;;
;CoinDCX;US$2,15 ;8/10/21;India;Maharashtra;Financial Services;Polychain Capital, Coinbase Ventures, Jump Capital;;;;;;;;;;;;;;;;;;;;;;;;;;;;;;;;;;;;;;;;;;;;;;;;;;;;;;
;Eightfold;US$2,10 ;10/27/20;United States;Santa Clara;Enterprise Tech;Foundation Capital, Institutional Venture Partners, General Catalyst;;;;;;;;;;;;;;;;;;;;;;;;;;;;;;;;;;;;;;;;;;;;;;;;;;;;;;
;Urban Company;US$2,10 ;4/27/21;India;Gurgaon;Consumer & Retail;VY Capital, Accel, Elevation Capital;;;;;;;;;;;;;;;;;;;;;;;;;;;;;;;;;;;;;;;;;;;;;;;;;;;;;;
;Moveworks;US$2,10 ;6/30/21;United States;Mountain View;Enterprise Tech;Lightspeed Venture Partners, Sapphire Ventures, Kleiner Perkins Caufield & Byers;;;;;;;;;;;;;;;;;;;;;;;;;;;;;;;;;;;;;;;;;;;;;;;;;;;;;;
;Medable;US$2,10 ;10/26/21;United States;Palo Alto;Healthcare & Life Sciences;GSR Ventures, Sapphire Ventures, Streamlined Ventures;;;;;;;;;;;;;;;;;;;;;;;;;;;;;;;;;;;;;;;;;;;;;;;;;;;;;;
;GoCardless;US$2,10 ;2/8/22;United Kingdom;London;Financial Services;Accel, Passion Capital, Balderton Capital;;;;;;;;;;;;;;;;;;;;;;;;;;;;;;;;;;;;;;;;;;;;;;;;;;;;;;
;Aledade;US$3,50 ;1/19/21;United States;Bethesda;Healthcare & Life Sciences;Venrock, CVF Capital Partners, ARCH Venture Partners;;;;;;;;;;;;;;;;;;;;;;;;;;;;;;;;;;;;;;;;;;;;;;;;;;;;;;
;A24 Films;US$3,50 ;3/9/22;United States;New York;Media & Entertainment;Stripes Group, Neuberger Berman;;;;;;;;;;;;;;;;;;;;;;;;;;;;;;;;;;;;;;;;;;;;;;;;;;;;;;
;Forto;US$2,10 ;6/21/21;Germany;Berlin;Industrials;Cherry Ventures, Northzone Ventures, Global Founders Capital;;;;;;;;;;;;;;;;;;;;;;;;;;;;;;;;;;;;;;;;;;;;;;;;;;;;;;
;bolttech;US$2,10 ;7/1/21;Singapore;;Insurance;Mundi Ventures, Doqling Capital Partners, Activant Capital;;;;;;;;;;;;;;;;;;;;;;;;;;;;;;;;;;;;;;;;;;;;;;;;;;;;;;
;Synthesia;US$2,10 ;6/13/23;United Kingdom;London;Enterprise Tech;Google Ventures, Kleiner Perkins Caufield & Byers, FirstMark Capital;;;;;;;;;;;;;;;;;;;;;;;;;;;;;;;;;;;;;;;;;;;;;;;;;;;;;;
;Jeeves;US$2,10 ;3/14/22;United States;Orlando;Enterprise Tech;Tencent Holdings, CRV, Clocktower Technology Ventures;;;;;;;;;;;;;;;;;;;;;;;;;;;;;;;;;;;;;;;;;;;;;;;;;;;;;;
;Viva Wallet;US$2,05 ;12/17/22;Greece;Athens;Financial Services;Breyer Capital, Hedosophia;;;;;;;;;;;;;;;;;;;;;;;;;;;;;;;;;;;;;;;;;;;;;;;;;;;;;;
;MUSINSA;US$2,00 ;11/11/19;South Korea;Seoul;Consumer & Retail;Sequoia Capital;;;;;;;;;;;;;;;;;;;;;;;;;;;;;;;;;;;;;;;;;;;;;;;;;;;;;;
;DeepL;US$2,00 ;1/11/23;Germany;Cologne;Enterprise Tech;Benchmark, btov Partners, Bessemer Venture Partners;;;;;;;;;;;;;;;;;;;;;;;;;;;;;;;;;;;;;;;;;;;;;;;;;;;;;;
;Melio;US$2,00 ;1/25/21;United States;New York;Financial Services;Accel, Aleph, American Express Ventures;;;;;;;;;;;;;;;;;;;;;;;;;;;;;;;;;;;;;;;;;;;;;;;;;;;;;;
;Firefly Aerospace;US$2,00 ;5/4/24;United States;Cedar Park;Industrials;Noosphere Ventures, RPM Ventures, SMS Capital Investment;;;;;;;;;;;;;;;;;;;;;;;;;;;;;;;;;;;;;;;;;;;;;;;;;;;;;;
;Cognition AI;US$2,00 ;4/24/24;United States;San Francisco;Enterprise Tech;Founders Fund, Khosla Ventures;;;;;;;;;;;;;;;;;;;;;;;;;;;;;;;;;;;;;;;;;;;;;;;;;;;;;;
;Babel Finance;US$2,00 ;5/25/22;Hong Kong;Hong Kong;Financial Services;Dragonfly Capital, BAI Capital, 10T Fund;;;;;;;;;;;;;;;;;;;;;;;;;;;;;;;;;;;;;;;;;;;;;;;;;;;;;;
;Trendy Group International;US$2,00 ;2/13/12;Hong Kong;Kowloon;Consumer & Retail;L Capital Partners;;;;;;;;;;;;;;;;;;;;;;;;;;;;;;;;;;;;;;;;;;;;;;;;;;;;;;
;GrubMarket;US$2,00 ;9/14/21;United States;San Francisco;Consumer & Retail;GGV Capital, BlackRock, ACE & Company;;;;;;;;;;;;;;;;;;;;;;;;;;;;;;;;;;;;;;;;;;;;;;;;;;;;;;
;BeZero;US$2,00 ;11/14/22;United Kingdom;London;Enterprise Tech;Contrarian Ventures, Molten Ventures, Hitachi Ventures 32;;;;;;;;;;;;;;;;;;;;;;;;;;;;;;;;;;;;;;;;;;;;;;;;;;;;;;
;Cohere;US$2,00 ;5/2/23;Canada;Toronto;Enterprise Tech;Index Ventures, Salesforce Ventures, Section 32;;;;;;;;;;;;;;;;;;;;;;;;;;;;;;;;;;;;;;;;;;;;;;;;;;;;;;
;Cohere;US$2,00 ;5/2/23;Canada;Toronto;Enterprise Tech;Index Ventures, Salesforce Ventures, Section 32;;;;;;;;;;;;;;;;;;;;;;;;;;;;;;;;;;;;;;;;;;;;;;;;;;;;;;
;GO1;US$2,00 ;7/19/21;Australia;Brisbane;Enterprise Tech;Y Combinator, M12, SEEK;;;;;;;;;;;;;;;;;;;;;;;;;;;;;;;;;;;;;;;;;;;;;;;;;;;;;;
;Clear Street;US$2,00 ;4/29/22;United States;New York;Financial Services;NextGen Venture Partners, Prysm Capital, McLaren Strategic Ventures;;;;;;;;;;;;;;;;;;;;;;;;;;;;;;;;;;;;;;;;;;;;;;;;;;;;;;
