;"Global Unicorn Club: Private Companies Valued at $1B+
(as of January 7th, 2025)";;;;;;;;;;;;;;;;;;;;;;;;;;;;;;;;;;;;;;;;;;;;;;;;;;;;;;;;;;;;
;;;;;;;;;;;;;;;;;;;;;;;;;;;;;;;;;;;;;;;;;;;;;;;;;;;;;;;;;;;;;
;Company;Valuation ($B);Date Joined;Country;City;Industry;Select Investors;;;;;;;;;;;;;;;;;;;;;;;;;;;;;;;;;;;;;;;;;;;;;;;;;;;;;;
;SpaceX;US$350,00 ;12/1/12;United States;Hawthorne;Industrials;Founders Fund, Draper Fisher Jurvetson, Rothenberg Ventures;;;;;;;;;;;;;;;;;;;;;;;;;;;;;;;;;;;;;;;;;;;;;;;;;;;;;;
;ByteDance;US$300,00 ;4/7/17;China;Beijing;Media & Entertainment;Sequoia Capital China, SIG Asia Investments, Sina Weibo, SoftBank Group;;;;;;;;;;;;;;;;;;;;;;;;;;;;;;;;;;;;;;;;;;;;;;;;;;;;;;
;OpenAI;US$157,00 ;7/22/19;United States;San Francisco;Enterprise Tech;Khosla Ventures, Thrive Capital, Sequoia Capital;;;;;;;;;;;;;;;;;;;;;;;;;;;;;;;;;;;;;;;;;;;;;;;;;;;;;;
;Stripe;US$70,00 ;1/23/14;United States;San Francisco;Financial Services;Khosla Ventures, LowercaseCapital, capitalG;;;;;;;;;;;;;;;;;;;;;;;;;;;;;;;;;;;;;;;;;;;;;;;;;;;;;;
;SHEIN;US$66,00 ;7/3/18;Singapore;;Consumer & Retail;Tiger Global Management, Sequoia Capital China, Shunwei Capital Partners;;;;;;;;;;;;;;;;;;;;;;;;;;;;;;;;;;;;;;;;;;;;;;;;;;;;;;
;Databricks;US$62,00 ;2/5/19;United States;San Francisco;Enterprise Tech;Andreessen Horowitz, New Enterprise Associates, Battery Ventures;;;;;;;;;;;;;;;;;;;;;;;;;;;;;;;;;;;;;;;;;;;;;;;;;;;;;;
;xAI;US$50,00 ;5/26/24;United States;Burlingame;Enterprise Tech;Sequoia Capital, Andreessen Horowitz, VY Capital;;;;;;;;;;;;;;;;;;;;;;;;;;;;;;;;;;;;;;;;;;;;;;;;;;;;;;
;Revolut;US$45,00 ;4/26/18;United Kingdom;London;Financial Services;Index Ventures, DST Global, Ribbit Capital;;;;;;;;;;;;;;;;;;;;;;;;;;;;;;;;;;;;;;;;;;;;;;;;;;;;;;
;Canva;US$32,00 ;1/8/18;Australia;Surry Hills;Enterprise Tech;Sequoia Capital China, Blackbird Ventures, Matrix Partners;;;;;;;;;;;;;;;;;;;;;;;;;;;;;;;;;;;;;;;;;;;;;;;;;;;;;;
;Fanatics;US$31,00 ;6/6/12;United States;Jacksonville;Consumer & Retail;SoftBank Group, Andreessen Horowitz, Temasek Holdings;;;;;;;;;;;;;;;;;;;;;;;;;;;;;;;;;;;;;;;;;;;;;;;;;;;;;;
;Epic Games;US$22,50 ;10/26/18;United States;Cary;Media & Entertainment;Tencent Holdings, KKR, Smash Ventures;;;;;;;;;;;;;;;;;;;;;;;;;;;;;;;;;;;;;;;;;;;;;;;;;;;;;;
;Chime;US$25,00 ;3/5/19;United States;San Francisco;Financial Services;Forerunner Ventures, Crosslink Capital, Homebrew;;;;;;;;;;;;;;;;;;;;;;;;;;;;;;;;;;;;;;;;;;;;;;;;;;;;;;
;CoreWeave;US$23,00 ;4/20/23;United States;Roseland;Enterprise Tech;Magnetar Capital;;;;;;;;;;;;;;;;;;;;;;;;;;;;;;;;;;;;;;;;;;;;;;;;;;;;;;
;Miro;US$17,50 ;1/5/22;United States;San Francisco;Enterprise Tech;Accel, AltaIR Capital, Technology Crossover Ventures;;;;;;;;;;;;;;;;;;;;;;;;;;;;;;;;;;;;;;;;;;;;;;;;;;;;;;
;Xiaohongshu;US$17,00 ;3/31/16;China;Shanghai;Media & Entertainment;GGV Capital, ZhenFund, Tencent;;;;;;;;;;;;;;;;;;;;;;;;;;;;;;;;;;;;;;;;;;;;;;;;;;;;;;
;Anthropic;US$16,05 ;2/3/23;United States;San Francisco;Enterprise Tech;Google;;;;;;;;;;;;;;;;;;;;;;;;;;;;;;;;;;;;;;;;;;;;;;;;;;;;;;
;Yuanfudao;US$15,50 ;5/31/17;China;Beijing;Consumer & Retail;Tencent Holdings, Warbug Pincus, IDG Capital;;;;;;;;;;;;;;;;;;;;;;;;;;;;;;;;;;;;;;;;;;;;;;;;;;;;;;
;DJI Innovations;US$15,00 ;1/23/15;China;Shenzhen;Industrials;Accel Partners, Sequoia Capital;;;;;;;;;;;;;;;;;;;;;;;;;;;;;;;;;;;;;;;;;;;;;;;;;;;;;;
;Discord;US$15,00 ;4/20/18;United States;San Francisco;Media & Entertainment;Benchmark, Greylock Partners, Tencent Holdings;;;;;;;;;;;;;;;;;;;;;;;;;;;;;;;;;;;;;;;;;;;;;;;;;;;;;;
;Gopuff;US$15,00 ;10/8/20;United States;Philadelphia;Consumer & Retail;Accel, SoftBank Group, Anthos Capital;;;;;;;;;;;;;;;;;;;;;;;;;;;;;;;;;;;;;;;;;;;;;;;;;;;;;;
;Yuanqi Senlin;US$15,00 ;3/1/20;China;Beijing;Consumer & Retail;Sequoia Capital China, Longfor Capitalm, Gaorong Capital;;;;;;;;;;;;;;;;;;;;;;;;;;;;;;;;;;;;;;;;;;;;;;;;;;;;;;
;Ripple;US$15,00 ;12/20/19;United States;San Francisco;Financial Services;IDG Capital, Venture51, Lightspeed Venture Partners;;;;;;;;;;;;;;;;;;;;;;;;;;;;;;;;;;;;;;;;;;;;;;;;;;;;;;
;Klarna;US$14,50 ;12/12/11;Sweden;Stockholm;Financial Services;Institutional Venture Partners, Sequoia Capital, General Atlantic;;;;;;;;;;;;;;;;;;;;;;;;;;;;;;;;;;;;;;;;;;;;;;;;;;;;;;
;Anduril;US$14,00 ;9/11/19;United States;Irvine;Industrials;Andreessen Horowitz, Founders Fund, Revolution Ventures;;;;;;;;;;;;;;;;;;;;;;;;;;;;;;;;;;;;;;;;;;;;;;;;;;;;;;
;Scale;US$13,80 ;8/5/19;United States;San Francisco;Enterprise Tech;Accel, Y Combinator, Index Ventures;;;;;;;;;;;;;;;;;;;;;;;;;;;;;;;;;;;;;;;;;;;;;;;;;;;;;;
;Plaid;US$13,50 ;12/11/18;United States;San Francisco;Financial Services;New Enterprise Associates, Spar Capital, Index Ventures;;;;;;;;;;;;;;;;;;;;;;;;;;;;;;;;;;;;;;;;;;;;;;;;;;;;;;
;Rippling;US$13,50 ;8/4/20;United States;San Francisco;Enterprise Tech;Initialized Capital, Y Combinator, Kleiner Perkins Caufield & Byers;;;;;;;;;;;;;;;;;;;;;;;;;;;;;;;;;;;;;;;;;;;;;;;;;;;;;;
;OpenSea;US$13,30 ;7/20/21;United States;New York;Media & Entertainment;Andreessen Horowitz, Thirty Five Ventures, Sound Ventures;;;;;;;;;;;;;;;;;;;;;;;;;;;;;;;;;;;;;;;;;;;;;;;;;;;;;;
;Celonis;US$13,00 ;6/26/18;Germany;Munich;Enterprise Tech;Accel, 83North;;;;;;;;;;;;;;;;;;;;;;;;;;;;;;;;;;;;;;;;;;;;;;;;;;;;;;
;Grammarly;US$13,00 ;10/10/19;United States;San Francisco;Media & Entertainment;General Catalyst, Institutional Venture Partners, Breyer Capital;;;;;;;;;;;;;;;;;;;;;;;;;;;;;;;;;;;;;;;;;;;;;;;;;;;;;;
;Devoted Health;US$12,90 ;10/16/18;United States;Waltham;Healthcare & Life Sciences;Andreessen Horowitz, F-Prime Capital, Venrock;;;;;;;;;;;;;;;;;;;;;;;;;;;;;;;;;;;;;;;;;;;;;;;;;;;;;;
;Faire;US$12,59 ;10/30/19;United States;San Francisco;Consumer & Retail;Khosla Ventures, Forerunner Ventures, Sequoia Capital;;;;;;;;;;;;;;;;;;;;;;;;;;;;;;;;;;;;;;;;;;;;;;;;;;;;;;
;Brex;US$12,30 ;10/5/18;United States;San Francisco;Enterprise Tech;DST Global, Ribbit Capital, Greenoaks Capital Management;;;;;;;;;;;;;;;;;;;;;;;;;;;;;;;;;;;;;;;;;;;;;;;;;;;;;;
;JUUL Labs;US$12,00 ;12/20/17;United States;San Francisco;Consumer & Retail;Tiger Global Management;;;;;;;;;;;;;;;;;;;;;;;;;;;;;;;;;;;;;;;;;;;;;;;;;;;;;;
;Wiz;US$12,00 ;3/17/21;Israel;Tel Aviv;Enterprise Tech;Insight Partners, Sequoia Capital, Index Ventures;;;;;;;;;;;;;;;;;;;;;;;;;;;;;;;;;;;;;;;;;;;;;;;;;;;;;;
;Bitmain Technologies;US$12,00 ;7/6/18;China;Beijing;Enterprise Tech;Coatue Management, Sequoia Capital China, IDG Capital;;;;;;;;;;;;;;;;;;;;;;;;;;;;;;;;;;;;;;;;;;;;;;;;;;;;;;
;GoodLeap;US$12,00 ;10/13/21;United States;Roseville;Financial Services;New Enterprise Associates, BDT Capital Partners, Davidson Kempner Capital Management;;;;;;;;;;;;;;;;;;;;;;;;;;;;;;;;;;;;;;;;;;;;;;;;;;;;;;
;Xingsheng Selected;US$12,00 ;7/22/20;China;Changsha;Consumer & Retail;KKR, Tencent Holdings, Sequoia Capital China;;;;;;;;;;;;;;;;;;;;;;;;;;;;;;;;;;;;;;;;;;;;;;;;;;;;;;
;Deel;US$12,00 ;4/21/21;United States;San Francisco;Enterprise Tech;Andreessen Horowitz, Spark Capital, Y Combinator;;;;;;;;;;;;;;;;;;;;;;;;;;;;;;;;;;;;;;;;;;;;;;;;;;;;;;
;Airtable;US$11,70 ;11/15/18;United States;San Francisco;Enterprise Tech;Caffeinated Capital, CRV, Founder Collective;;;;;;;;;;;;;;;;;;;;;;;;;;;;;;;;;;;;;;;;;;;;;;;;;;;;;;
;BYJU's;US$11,50 ;7/25/17;India;Bengaluru;Consumer & Retail;Tencent Holdings, Lightspeed India Partners, Sequoia Capital India;;;;;;;;;;;;;;;;;;;;;;;;;;;;;;;;;;;;;;;;;;;;;;;;;;;;;;
;ZongMu Technology;US$11,40 ;6/3/21;China;Shanghai;Industrials;LTW Capital, Legend Capital, Qualcomm Ventures;;;;;;;;;;;;;;;;;;;;;;;;;;;;;;;;;;;;;;;;;;;;;;;;;;;;;;
;Global Switch;US$11,10 ;12/22/16;United Kingdom;London;Enterprise Tech;Aviation Industry Corporation of China, Essence Financial, Jiangsu Sha Steel Group;;;;;;;;;;;;;;;;;;;;;;;;;;;;;;;;;;;;;;;;;;;;;;;;;;;;;;
;Checkout.com;US$11,00 ;5/2/19;United Kingdom;London;Financial Services;Tiger Global Management, Insight Partners, DST Global;;;;;;;;;;;;;;;;;;;;;;;;;;;;;;;;;;;;;;;;;;;;;;;;;;;;;;
;Bolt;US$11,00 ;10/8/21;United States;San Francisco;Financial Services;Activant Capital, Tribe Capital, General Atlantic;;;;;;;;;;;;;;;;;;;;;;;;;;;;;;;;;;;;;;;;;;;;;;;;;;;;;;
;Alchemy;US$10,20 ;10/28/21;United States;San Francisco;Enterprise Tech;DFJ Growth Fund, Coatue Management, Addition;;;;;;;;;;;;;;;;;;;;;;;;;;;;;;;;;;;;;;;;;;;;;;;;;;;;;;
;Huolala;US$10,00 ;2/21/19;China;Guangzhou;Industrials;MindWorks Ventures, Shunwei Capital Partners, Xiang He Capital;;;;;;;;;;;;;;;;;;;;;;;;;;;;;;;;;;;;;;;;;;;;;;;;;;;;;;
;Gusto;US$10,00 ;12/18/15;United States;San Francisco;Financial Services;General Catalyst Partners, Google Ventures, Kleiner Perkins Caufield & Byers;;;;;;;;;;;;;;;;;;;;;;;;;;;;;;;;;;;;;;;;;;;;;;;;;;;;;;
;Chehaoduo;US$10,00 ;3/12/16;China;Beijing;Consumer & Retail;Sequoia Capital China, GX Capital;;;;;;;;;;;;;;;;;;;;;;;;;;;;;;;;;;;;;;;;;;;;;;;;;;;;;;
;Talkdesk;US$10,00 ;10/3/18;United States;San Francisco;Enterprise Tech;DJF, Salesforce Ventures, Storm Ventures;;;;;;;;;;;;;;;;;;;;;;;;;;;;;;;;;;;;;;;;;;;;;;;;;;;;;;
;Notion;US$10,00 ;4/1/20;United States;San Francisco;Enterprise Tech;Index Ventures, Draft Ventures, Felicis Ventures;;;;;;;;;;;;;;;;;;;;;;;;;;;;;;;;;;;;;;;;;;;;;;;;;;;;;;
;Digital Currency Group;US$10,00 ;11/1/21;United States;New York;Financial Services;Ribbit Capital, capitalG, Softbank Group;;;;;;;;;;;;;;;;;;;;;;;;;;;;;;;;;;;;;;;;;;;;;;;;;;;;;;
;KuCoin;US$10,00 ;5/10/22;Seychelles;Victoria;Financial Services;IDG Capital, Matrix Partners China, Jump Crypto;;;;;;;;;;;;;;;;;;;;;;;;;;;;;;;;;;;;;;;;;;;;;;;;;;;;;;
;ServiceTitan;US$9,50 ;11/14/18;United States;Glendale;Industrials;Bessemer Venture Partners, ICONIQ Capital, Battery Ventures;;;;;;;;;;;;;;;;;;;;;;;;;;;;;;;;;;;;;;;;;;;;;;;;;;;;;;
;HEYTEA;US$9,28 ;7/1/19;China;Shenzhen;Consumer & Retail;Sequoia Capital China, Tencent Investment, BA Capital;;;;;;;;;;;;;;;;;;;;;;;;;;;;;;;;;;;;;;;;;;;;;;;;;;;;;;
;N26;US$9,23 ;1/10/19;Germany;Berlin;Financial Services;Redalpine Venture Partners, Earlybird Venture Capital, Valar Ventures;;;;;;;;;;;;;;;;;;;;;;;;;;;;;;;;;;;;;;;;;;;;;;;;;;;;;;
;Navan;US$9,20 ;11/8/18;United States;Palo Alto;Enterprise Tech;Andreessen Horowitz, Lightspeed Venture Partners, Zeev Ventures;;;;;;;;;;;;;;;;;;;;;;;;;;;;;;;;;;;;;;;;;;;;;;;;;;;;;;
;VAST Data;US$9,10 ;4/16/20;United States;New York;Enterprise Tech;Norwest Venture Partners, Goldman Sachs, Dell Technologies Capital;;;;;;;;;;;;;;;;;;;;;;;;;;;;;;;;;;;;;;;;;;;;;;;;;;;;;;
;Northvolt;US$9,08 ;6/12/19;Sweden;Stockholm;Industrials;Vattenfall, Volkswagen Group, Goldman Sachs;;;;;;;;;;;;;;;;;;;;;;;;;;;;;;;;;;;;;;;;;;;;;;;;;;;;;;
;Perplexity;US$9,00 ;4/23/24;United States;San Francisco;Enterprise Tech;New Enterprise Associates, Institutional Venture Partners, NVentures;;;;;;;;;;;;;;;;;;;;;;;;;;;;;;;;;;;;;;;;;;;;;;;;;;;;;;
;Tanium;US$9,00 ;3/31/15;United States;Kirkland;Enterprise Tech;Andreessen Horowitz, Nor-Cal Invest, TPG Growth;;;;;;;;;;;;;;;;;;;;;;;;;;;;;;;;;;;;;;;;;;;;;;;;;;;;;;
;Niantic;US$9,00 ;11/24/17;United States;San Francisco;Media & Entertainment;Nintendo, Google, Pokemon Company International, Spark Capital;;;;;;;;;;;;;;;;;;;;;;;;;;;;;;;;;;;;;;;;;;;;;;;;;;;;;;
;OYO Rooms;US$9,00 ;9/25/18;India;Gurugram;Consumer & Retail;SoftBank Group, Sequoia Capital India, Lightspeed India Partners;;;;;;;;;;;;;;;;;;;;;;;;;;;;;;;;;;;;;;;;;;;;;;;;;;;;;;
;Rapyd;US$8,75 ;12/3/19;United Kingdom;London;Financial Services;Target Global, General Catalyst, Durable Capital Partners;;;;;;;;;;;;;;;;;;;;;;;;;;;;;;;;;;;;;;;;;;;;;;;;;;;;;;
;Kavak;US$8,70 ;10/1/20;Mexico;Lerma de Villada;Industrials;DST Global, SoftBank Group, Mountain Nazca;;;;;;;;;;;;;;;;;;;;;;;;;;;;;;;;;;;;;;;;;;;;;;;;;;;;;;
;Nuro;US$8,60 ;2/11/19;United States;Mountain View;Industrials;SoftBank Group, Greylock Partners, Gaorong Capital;;;;;;;;;;;;;;;;;;;;;;;;;;;;;;;;;;;;;;;;;;;;;;;;;;;;;;
;Chainalysis;US$8,60 ;11/23/20;United States;New York;Financial Services;Addition, Benhcmark, Accel;;;;;;;;;;;;;;;;;;;;;;;;;;;;;;;;;;;;;;;;;;;;;;;;;;;;;;
;Personio;US$8,50 ;1/19/21;Germany;Munich;Enterprise Tech;Global Founders Capital, Nortzone Ventures, Picus Capital;;;;;;;;;;;;;;;;;;;;;;;;;;;;;;;;;;;;;;;;;;;;;;;;;;;;;;
;SumUp;US$8,50 ;7/16/19;United Kingdom;London;Financial Services;American Express Ventures, Goldman Sachs, Bain Capital Credit;;;;;;;;;;;;;;;;;;;;;;;;;;;;;;;;;;;;;;;;;;;;;;;;;;;;;;
;Bolt;US$8,40 ;5/29/18;Estonia;Tallinn;Industrials;Didi Chuxing, Diamler, TMT Investments;;;;;;;;;;;;;;;;;;;;;;;;;;;;;;;;;;;;;;;;;;;;;;;;;;;;;;
;Tipalti;US$8,30 ;10/6/20;United States;San Mateo;Enterprise Tech;01 Advisors, Zeev Ventures, Group 11;;;;;;;;;;;;;;;;;;;;;;;;;;;;;;;;;;;;;;;;;;;;;;;;;;;;;;
;Dream11;US$8,00 ;4/9/19;India;Mumbai;Media & Entertainment;Kaalari Capital, Tencent Holdings, Steadview Capital;;;;;;;;;;;;;;;;;;;;;;;;;;;;;;;;;;;;;;;;;;;;;;;;;;;;;;
;Fireblocks;US$8,00 ;7/27/21;United States;New York;Financial Services;Tenaya Capital, Coatue Management, Stripes Group;;;;;;;;;;;;;;;;;;;;;;;;;;;;;;;;;;;;;;;;;;;;;;;;;;;;;;
;Flexport;US$8,00 ;4/30/18;United States;San Francisco;Industrials;Bloomberg Beta, Founders Fund, First Round Capital;;;;;;;;;;;;;;;;;;;;;;;;;;;;;;;;;;;;;;;;;;;;;;;;;;;;;;
;FalconX;US$8,00 ;8/10/21;United States;San Mateo;Financial Services;Tiger Global Management, American Express Ventures, B Capital Group;;;;;;;;;;;;;;;;;;;;;;;;;;;;;;;;;;;;;;;;;;;;;;;;;;;;;;
;Caris;US$7,83 ;5/12/21;United States;Irving;Healthcare & Life Sciences;Sixth Street Partners, OrbiMed Advisors, Highland Capital Management;;;;;;;;;;;;;;;;;;;;;;;;;;;;;;;;;;;;;;;;;;;;;;;;;;;;;;
;Ramp;US$7,65 ;3/29/21;United States;New York;Enterprise Tech;D1 Capital Partners, Stripe, Coatue Management;;;;;;;;;;;;;;;;;;;;;;;;;;;;;;;;;;;;;;;;;;;;;;;;;;;;;;
;Dapper Labs;US$7,60 ;3/30/21;Canada;Vancouver;Media & Entertainment;Union Square Ventures, Venrock, Andreessen Horowitz;;;;;;;;;;;;;;;;;;;;;;;;;;;;;;;;;;;;;;;;;;;;;;;;;;;;;;
;Netskope;US$7,50 ;11/13/18;United States;Santa Clara;Enterprise Tech;Lightspeed Venture Partners, Social Capital, Accel;;;;;;;;;;;;;;;;;;;;;;;;;;;;;;;;;;;;;;;;;;;;;;;;;;;;;;
;Razorpay;US$7,50 ;10/11/20;India;Bengaluru;Financial Services;Sequoia Capital India, Tiger Global Management, Matrix Partners India;;;;;;;;;;;;;;;;;;;;;;;;;;;;;;;;;;;;;;;;;;;;;;;;;;;;;;
;Automattic;US$7,50 ;5/27/13;United States;San Francisco;Media & Entertainment;Insight Venture Partners, Lowercase Capital, Polaris Partners;;;;;;;;;;;;;;;;;;;;;;;;;;;;;;;;;;;;;;;;;;;;;;;;;;;;;;
;Carta;US$7,40 ;5/6/19;United States;San Francisco;Financial Services;Menlo Ventures, Spark Capital, Union Square Ventures;;;;;;;;;;;;;;;;;;;;;;;;;;;;;;;;;;;;;;;;;;;;;;;;;;;;;;
;Snyk;US$7,40 ;1/21/20;United States;Boston;Enterprise Tech;BOLDstart Ventures, Google Ventures, Accel;;;;;;;;;;;;;;;;;;;;;;;;;;;;;;;;;;;;;;;;;;;;;;;;;;;;;;
;Gong;US$7,25 ;8/12/20;United States;Palo Alto;Enterprise Tech;Norwest Venture Partners, Next World Capital, Wing Venture Capital;;;;;;;;;;;;;;;;;;;;;;;;;;;;;;;;;;;;;;;;;;;;;;;;;;;;;;
;Gemini;US$7,10 ;11/19/21;United States;New York;Financial Services;Morgan Creek Digital, Marcy Venture Partners, 10T Fund;;;;;;;;;;;;;;;;;;;;;;;;;;;;;;;;;;;;;;;;;;;;;;;;;;;;;;
;Blockchain.com;US$7,00 ;2/17/21;United Kingdom;London;Financial Services;Lightspeed Venture Partners, Google Ventures, Lakestar;;;;;;;;;;;;;;;;;;;;;;;;;;;;;;;;;;;;;;;;;;;;;;;;;;;;;;
;Toss;US$7,00 ;12/9/18;South Korea;Seoul;Financial Services;Bessemer Venture Partners, Qualcomm Ventures, Kleiner Perkins Caufield & Byers;;;;;;;;;;;;;;;;;;;;;;;;;;;;;;;;;;;;;;;;;;;;;;;;;;;;;;
;We Doctor;US$7,00 ;9/22/15;China;Hangzhou;Healthcare & Life Sciences;Tencent, Morningside Group;;;;;;;;;;;;;;;;;;;;;;;;;;;;;;;;;;;;;;;;;;;;;;;;;;;;;;
;Ro;US$7,00 ;7/27/20;United States;New York;Healthcare & Life Sciences;Initialized Capital, General Catalyst, SignalFire;;;;;;;;;;;;;;;;;;;;;;;;;;;;;;;;;;;;;;;;;;;;;;;;;;;;;;
;ConsenSys;US$7,00 ;11/17/21;United States;New York;Enterprise Tech;Third Point, Electric Capital, Coinbase Ventures;;;;;;;;;;;;;;;;;;;;;;;;;;;;;;;;;;;;;;;;;;;;;;;;;;;;;;
;Automation Anywhere;US$6,80 ;7/2/18;United States;San Jose;Enterprise Tech;General Atlantic, Goldman Sachs, New Enterprise Associates;;;;;;;;;;;;;;;;;;;;;;;;;;;;;;;;;;;;;;;;;;;;;;;;;;;;;;
;1Password;US$6,80 ;7/8/21;Canada;Toronto;Enterprise Tech;Slack Fund, Accel, Skip Capital;;;;;;;;;;;;;;;;;;;;;;;;;;;;;;;;;;;;;;;;;;;;;;;;;;;;;;
;Ziroom;US$6,60 ;1/17/18;China;Beijing;Consumer & Retail;Sequoia Capital China, Warburg Pincus, General Catalyst;;;;;;;;;;;;;;;;;;;;;;;;;;;;;;;;;;;;;;;;;;;;;;;;;;;;;;
;SVOLT;US$6,51 ;6/8/20;China;Changzhou;Industrials;IDG Capital, Bank Of China Group Investment,, SDIC CMC Investment Management;;;;;;;;;;;;;;;;;;;;;;;;;;;;;;;;;;;;;;;;;;;;;;;;;;;;;;
;National Stock Exchange of India;US$6,50 ;7/1/20;India;Mumbai;Financial Services;TA Associates, SoftBank Group, GS Growth;;;;;;;;;;;;;;;;;;;;;;;;;;;;;;;;;;;;;;;;;;;;;;;;;;;;;;
;Mollie;US$6,50 ;9/8/20;Netherlands;Amsterdam;Financial Services;Technology Crossover Ventures;;;;;;;;;;;;;;;;;;;;;;;;;;;;;;;;;;;;;;;;;;;;;;;;;;;;;;
;Doctolib;US$6,40 ;3/19/19;France;Paris;Healthcare & Life Sciences;BPI France, Kerala Ventures, Accel;;;;;;;;;;;;;;;;;;;;;;;;;;;;;;;;;;;;;;;;;;;;;;;;;;;;;;
;CRED;US$6,40 ;4/6/21;India;Bengaluru;Financial Services;Tiger Global Management, DST Global, Sequoia Capital India;;;;;;;;;;;;;;;;;;;;;;;;;;;;;;;;;;;;;;;;;;;;;;;;;;;;;;
;DataRobot;US$6,30 ;7/29/19;United States;Boston;Enterprise Tech;New Enterprise Associates, Accomplice, IA Ventures;;;;;;;;;;;;;;;;;;;;;;;;;;;;;;;;;;;;;;;;;;;;;;;;;;;;;;
;Upgrade;US$6,28 ;2/12/18;United States;San Francisco;Financial Services;Union Square Ventures, Ribbit Capital, VY Capital;;;;;;;;;;;;;;;;;;;;;;;;;;;;;;;;;;;;;;;;;;;;;;;;;;;;;;
;Mistral AI;US$6,22 ;12/10/23;France;Paris;Enterprise Tech;Lightspeed Venture Partners, General Catalyst, Andreessen Horowitz;;;;;;;;;;;;;;;;;;;;;;;;;;;;;;;;;;;;;;;;;;;;;;;;;;;;;;
;Hinge Health;US$6,20 ;1/6/21;United States;San Francisco;Healthcare & Life Sciences;Atomico, Insight Partners, Coatue Management;;;;;;;;;;;;;;;;;;;;;;;;;;;;;;;;;;;;;;;;;;;;;;;;;;;;;;
;Black Unicorn Factory;US$6,10 ;5/20/21;United States;Los Angeles;Enterprise Tech;Barter Ventures;;;;;;;;;;;;;;;;;;;;;;;;;;;;;;;;;;;;;;;;;;;;;;;;;;;;;;
;Benchling;US$6,10 ;4/14/21;United States;San Francisco;Healthcare & Life Sciences;Thrive Capital, Benchmark, MenloVentures;;;;;;;;;;;;;;;;;;;;;;;;;;;;;;;;;;;;;;;;;;;;;;;;;;;;;;
;Grafana Labs;US$6,00 ;3/25/21;United States;New York;Enterprise Tech;Lightspeed Venture Partners, Lead Edge Capital, Coatue Management;;;;;;;;;;;;;;;;;;;;;;;;;;;;;;;;;;;;;;;;;;;;;;;;;;;;;;
;Applied Intuition;US$6,00 ;10/22/20;United States;Sunnyvale;Industrials;Andreessen Horowitz, Lux Capital, General Catalyst;;;;;;;;;;;;;;;;;;;;;;;;;;;;;;;;;;;;;;;;;;;;;;;;;;;;;;
;Commure;US$6,00 ;9/16/21;United States;San Francisco;Healthcare & Life Sciences;General Catalyst, HCA Healthcare;;;;;;;;;;;;;;;;;;;;;;;;;;;;;;;;;;;;;;;;;;;;;;;;;;;;;;
;Royole Corporation;US$6,00 ;8/18/15;China;Shenzhen;Industrials;Warmsun Holding, IDG Capital Partners;;;;;;;;;;;;;;;;;;;;;;;;;;;;;;;;;;;;;;;;;;;;;;;;;;;;;;
;iCapital Network;US$6,00 ;7/27/21;United States;New York;Financial Services;BlackRock, Blackstone, UBS;;;;;;;;;;;;;;;;;;;;;;;;;;;;;;;;;;;;;;;;;;;;;;;;;;;;;;
;6Sense;US$5,20 ;3/30/21;United States;San Francisco;Enterprise Tech;Venrock, Battery Ventures, Insight Partners;;;;;;;;;;;;;;;;;;;;;;;;;;;;;;;;;;;;;;;;;;;;;;;;;;;;;;
;Attentive;US$5,99 ;9/23/20;United States;Hoboken;Enterprise Tech;NextView Ventures, Eniac Ventures, Sequoia Capital;;;;;;;;;;;;;;;;;;;;;;;;;;;;;;;;;;;;;;;;;;;;;;;;;;;;;;
;Easyhome;US$5,78 ;2/12/18;China;Beijing;Consumer & Retail;Alibaba Group, Boyu Capital, Borui Capital;;;;;;;;;;;;;;;;;;;;;;;;;;;;;;;;;;;;;;;;;;;;;;;;;;;;;;
;Lianjia;US$5,77 ;4/7/16;China;Beijing;Financial Services;Tencent, Baidu, Huasheng Capital;;;;;;;;;;;;;;;;;;;;;;;;;;;;;;;;;;;;;;;;;;;;;;;;;;;;;;
;Workato;US$5,70 ;1/12/21;United States;Mountain View;Enterprise Tech;Battery Ventures, Storm Ventures, Redpoint Ventures;;;;;;;;;;;;;;;;;;;;;;;;;;;;;;;;;;;;;;;;;;;;;;;;;;;;;;
;Vuori;US$5,50 ;10/13/21;United States;Carlsbad;Consumer & Retail;SoftBank Group, Norwest Venture Partners;;;;;;;;;;;;;;;;;;;;;;;;;;;;;;;;;;;;;;;;;;;;;;;;;;;;;;
;Back Market;US$5,70 ;5/18/21;France;Paris;Consumer & Retail;Aglae Ventures, Eurazeo, Daphni;;;;;;;;;;;;;;;;;;;;;;;;;;;;;;;;;;;;;;;;;;;;;;;;;;;;;;
;RELEX;US$5,70 ;2/17/22;Finland;Helsinki;Consumer & Retail;Blackstone, Technology Crossover Ventures, Summit Partners;;;;;;;;;;;;;;;;;;;;;;;;;;;;;;;;;;;;;;;;;;;;;;;;;;;;;;
;The Boring Company;US$5,70 ;4/20/22;United States;Pflugerville;Industrials;VY Capital, 8VC, Craft Ventures;;;;;;;;;;;;;;;;;;;;;;;;;;;;;;;;;;;;;;;;;;;;;;;;;;;;;;
;Postman;US$5,60 ;6/11/20;United States;San Francisco;Enterprise Tech;Nexus Venture Partners, CRV, Insight Partners;;;;;;;;;;;;;;;;;;;;;;;;;;;;;;;;;;;;;;;;;;;;;;;;;;;;;;
;FiveTran;US$5,60 ;6/30/20;United States;Oakland;Enterprise Tech;Matrix Partners, Andreessen Horowitz, General Catalyst;;;;;;;;;;;;;;;;;;;;;;;;;;;;;;;;;;;;;;;;;;;;;;;;;;;;;;
;ContentSquare;US$5,60 ;5/25/21;France;Paris;Enterprise Tech;Highland Europe, Eurazeo, Canaan Partners;;;;;;;;;;;;;;;;;;;;;;;;;;;;;;;;;;;;;;;;;;;;;;;;;;;;;;
;Helsing;US$5,37 ;9/14/23;Germany;Munchen;Enterprise Tech;;;;;;;;;;;;;;;;;;;;;;;;;;;;;;;;;;;;;;;;;;;;;;;;;;;;;;;
;Trade Republic;US$5,36 ;5/20/21;Germany;Berlin;Financial Services;Founders Fund. Accel, Creandum;;;;;;;;;;;;;;;;;;;;;;;;;;;;;;;;;;;;;;;;;;;;;;;;;;;;;;
;Odoo;US$5,30 ;7/29/21;Belgium;Louvain-la-Neuve;Enterprise Tech;Summit Partners, Noshaq, Sofinnova Partners;;;;;;;;;;;;;;;;;;;;;;;;;;;;;;;;;;;;;;;;;;;;;;;;;;;;;;
;Rappi;US$5,25 ;8/31/18;Colombia;Bogota;Consumer & Retail;DST Global, Andreessen Horowitz, Sequoia Capital, Redpoint e.ventures;;;;;;;;;;;;;;;;;;;;;;;;;;;;;;;;;;;;;;;;;;;;;;;;;;;;;;
;Collibra;US$5,25 ;1/29/19;Belgium;Brussels;Enterprise Tech;Index Ventures, Battery Ventures, ICONIQ Capital;;;;;;;;;;;;;;;;;;;;;;;;;;;;;;;;;;;;;;;;;;;;;;;;;;;;;;
;Sierra;US$4,50 ;10/28/24;United States;San Francisco;Enterprise Tech;Benchmark, Sequoia Capital, Thrive Capital;;;;;;;;;;;;;;;;;;;;;;;;;;;;;;;;;;;;;;;;;;;;;;;;;;;;;;
;OneTrust;US$4,50 ;7/11/19;United States;Atlanta;Enterprise Tech;Insight Partners;;;;;;;;;;;;;;;;;;;;;;;;;;;;;;;;;;;;;;;;;;;;;;;;;;;;;;
;QuintoAndar;US$5,10 ;9/9/19;Brazil;Campinas;Financial Services;Kaszek Ventures, General Atlantic, SoftBank Group;;;;;;;;;;;;;;;;;;;;;;;;;;;;;;;;;;;;;;;;;;;;;;;;;;;;;;
;Monzo;US$5,90 ;10/31/18;United Kingdom;London;Financial Services;Passion Capital, Thrive Capital, Orange Digital Ventures;;;;;;;;;;;;;;;;;;;;;;;;;;;;;;;;;;;;;;;;;;;;;;;;;;;;;;
;C6 Bank;US$5,05 ;12/2/20;Brazil;Sao Paulo;Financial Services;Credit Suisse;;;;;;;;;;;;;;;;;;;;;;;;;;;;;;;;;;;;;;;;;;;;;;;;;;;;;;
;Safe Superintelligence;US$5,00 ;9/4/24;United States;San Francisco;Enterprise Tech;Sequoia Capital, DST Global, Andreessen Horowitz;;;;;;;;;;;;;;;;;;;;;;;;;;;;;;;;;;;;;;;;;;;;;;;;;;;;;;
;Redwood Materials;US$5,00 ;7/28/21;United States;Carson City;Industrials;Breakthrough Energy Ventures, Capricorn Investment Group, Valor Equity Partners;;;;;;;;;;;;;;;;;;;;;;;;;;;;;;;;;;;;;;;;;;;;;;;;;;;;;;
;Abnormal Security;US$5,10 ;5/10/22;United States;San Francisco;Enterprise Tech;Greylock Partners, Insight Partners,Menlo Ventures;;;;;;;;;;;;;;;;;;;;;;;;;;;;;;;;;;;;;;;;;;;;;;;;;;;;;;
;Hello TransTech;US$5,00 ;6/1/18;China;Shanghai;Industrials;Ant Financial Services Group, GGV Capital;;;;;;;;;;;;;;;;;;;;;;;;;;;;;;;;;;;;;;;;;;;;;;;;;;;;;;
;Airwallex;US$5,50 ;3/25/19;Australia;Melbourne;Financial Services;DST Global, Sequoia Capital China, Tencent Holdings;;;;;;;;;;;;;;;;;;;;;;;;;;;;;;;;;;;;;;;;;;;;;;;;;;;;;;
;Mambu;US$5,50 ;1/6/21;Netherlands;Amsterdam;Financial Services;Runa Capital, Acton Capital Partners, Point Nine Capital;;;;;;;;;;;;;;;;;;;;;;;;;;;;;;;;;;;;;;;;;;;;;;;;;;;;;;
;Oura;US$5,00 ;4/5/22;Finland;Oulu;Healthcare & Life Sciences;Forerunner Ventures, Lifeline Ventures, MSD Capital;;;;;;;;;;;;;;;;;;;;;;;;;;;;;;;;;;;;;;;;;;;;;;;;;;;;;;
;Howden Group Holdings;US$5,00 ;9/29/20;United Kingdom;London;Insurance;General Atlantic, 3i Group, Huagai Capital;;;;;;;;;;;;;;;;;;;;;;;;;;;;;;;;;;;;;;;;;;;;;;;;;;;;;;
;SambaNova Systems;US$5,00 ;4/13/21;United States;Palo Alto;Enterprise Tech;Walden International, Google Ventures, Intel Capital;;;;;;;;;;;;;;;;;;;;;;;;;;;;;;;;;;;;;;;;;;;;;;;;;;;;;;
;ZEPZ;US$5,00 ;8/23/21;United Kingdom;London;Financial Services;Accel, Technology Crossover Ventures, LeapFrog Investments;;;;;;;;;;;;;;;;;;;;;;;;;;;;;;;;;;;;;;;;;;;;;;;;;;;;;;
;OakNorth Bank;US$5,00 ;10/12/17;United Kingdom;London;Financial Services;Clermont Group, Coltrane Asset Management, Toscafund Asset Management;;;;;;;;;;;;;;;;;;;;;;;;;;;;;;;;;;;;;;;;;;;;;;;;;;;;;;
;Moon Active;US$5,00 ;1/26/20;Israel;Tel Aviv;Media & Entertainment;Insight Partners, Andalusian Capital Partners;;;;;;;;;;;;;;;;;;;;;;;;;;;;;;;;;;;;;;;;;;;;;;;;;;;;;;
;OfBusiness;US$5,00 ;7/31/21;India;Gurgaon;Industrials;Matrix Partners India, Falcon Edge Capital, SoftBank Group;;;;;;;;;;;;;;;;;;;;;;;;;;;;;;;;;;;;;;;;;;;;;;;;;;;;;;
;Cockroach Labs;US$5,00 ;1/12/21;United States;New York;Enterprise Tech;Google Ventures, Benchmark, FirstMark Capital;;;;;;;;;;;;;;;;;;;;;;;;;;;;;;;;;;;;;;;;;;;;;;;;;;;;;;
;Pine Labs;US$5,00 ;1/24/20;India;Noida;Financial Services;Sequoia Capital India, Temasek, PayPal Ventures;;;;;;;;;;;;;;;;;;;;;;;;;;;;;;;;;;;;;;;;;;;;;;;;;;;;;;
;Qonto;US$5,00 ;1/11/22;France;Paris;Enterprise Tech;Alven Capital, Valar Ventures, Tencent Holdings;;;;;;;;;;;;;;;;;;;;;;;;;;;;;;;;;;;;;;;;;;;;;;;;;;;;;;
;Icertis;US$5,00 ;7/17/19;United States;Bellevue;Enterprise Tech;Eight Roads Ventures, Greycroft, Ignition Partners;;;;;;;;;;;;;;;;;;;;;;;;;;;;;;;;;;;;;;;;;;;;;;;;;;;;;;
;Hopper;US$5,00 ;3/24/21;Canada;Montreal;Consumer & Retail;Capital One Growth Ventures, Citi Ventures, OMERS Ventures;;;;;;;;;;;;;;;;;;;;;;;;;;;;;;;;;;;;;;;;;;;;;;;;;;;;;;
